### ISSUE TITLE
Pods not able to ping each other on Multus interface - ARP oui unknown error

### ISSUE THREAD

**Issue by yockgen** [k8snetworkplumbingwg/multus-cni#813]
**What happend**:
Pods not able to ping each others via MacVlan overlay, tcpdump the receiving interface seeing following error:

kubectl exec -it test01-deployment-6f5b9549f9-kc2mg --03:50:46.421157 IP 192.168.15.225 > 192.168.15.227: ICMP echo request, id 17, seq 1, length 64
03:50:46.421208 ARP, Request who-has 192.168.15.225 tell 192.168.15.227, length 28
03:50:46.422273 ARP, Reply 192.168.15.225 is-at b2:ac:b9:55:e4:a4 (oui Unknown), length 46
03:50:46.422281 IP 192.168.15.227 > 192.168.15.225: ICMP echo reply, id 17, seq 1, length 64
03:50:47.433917 IP 192.168.15.225 > 192.168.15.227: ICMP echo request, id 17, seq 2, length 64
03:50:47.433962 IP 192.168.15.227 > 192.168.15.225: ICMP echo reply, id 17, seq 2, length 64
03:50:48.463068 IP 192.168.15.225 > 192.168.15.227: ICMP echo request, id 17, seq 3, length 64
03:50:48.463125 IP 192.168.15.227 > 192.168.15.225: ICMP echo reply, id 17, seq 3, length 64
03:50:49.480766 IP 192.168.15.225 > 192.168.15.227: ICMP echo request, id 17, seq 4, length 64
03:50:49.480837 IP 192.168.15.227 > 192.168.15.225: ICMP echo reply, id 17, seq 4, length 64
03:50:50.504176 IP 192.168.15.225 > 192.168.15.227: ICMP echo request, id 17, seq 5, length 64
03:50:50.504229 IP 192.168.15.227 > 192.168.15.225: ICMP echo reply, id 17, seq 5, length 64
03:50:51.465735 ARP, Request who-has 192.168.15.227 tell 192.168.15.225, length 46

**What you expected to happen**:
Pods able to ping each other via Macvlan network 

**How to reproduce it (as minimally and precisely as possible)**:

Macvlan configuration as below:
cat <<EOF | kubectl create -f -
apiVersion: "k8s.cni.cncf.io/v1"
kind: NetworkAttachmentDefinition
metadata:
name: yockgen-network
spec:
config: '{
"cniVersion": "0.4.0",
"name": "yockgen-network",
"type": "macvlan",
"master": "enp0s8",
"mode": "bridge",
"ipam": {
"type": "whereabouts",
"range": "192.168.15.225/28"
}
}'
EOF

**Anything else we need to know?**:
However, IPVlan configuration as below is working to ping each other:
cat <<EOF | kubectl create -f -
apiVersion: "k8s.cni.cncf.io/v1"
kind: NetworkAttachmentDefinition
metadata:
name: yockgen-network
spec:
config: '{
"cniVersion": "0.3.1",
"name": "yockgen-network",
"type": "ipvlan",
"master": "enp0s8",
"capabilities": {"ips":true},
"ipam": {
"type": "whereabouts",
"range": "192.168.15.225/28"
}
}'
EOF

**Environment**:

- Multus version 
  Image:      ghcr.io/k8snetworkplumbingwg/multus-cni:v3.8

- Kubernetes version (use `kubectl version`): 
Client Version: version.Info{Major:"1", Minor:"23", GitVersion:"v1.23.4", GitCommit:"e6c093d87ea4cbb530a7b2ae91e54c0842d8308a", GitTreeState:"clean", BuildDate:"2022-02-16T12:38:05Z", GoVersion:"go1.17.7", Compiler:"gc", Platform:"linux/amd64"}
Server Version: version.Info{Major:"1", Minor:"23", GitVersion:"v1.23.4", GitCommit:"e6c093d87ea4cbb530a7b2ae91e54c0842d8308a", GitTreeState:"clean", BuildDate:"2022-02-16T12:32:02Z", GoVersion:"go1.17.7", Compiler:"gc", Platform:"linux/amd64"}

- Primary CNI for Kubernetes cluster: Calico

- OS (e.g. from /etc/os-release):
NAME="Ubuntu"
VERSION="20.04.4 LTS (Focal Fossa)"
ID=ubuntu
ID_LIKE=debian
PRETTY_NAME="Ubuntu 20.04.4 LTS"
VERSION_ID="20.04"
HOME_URL="https://www.ubuntu.com/"
SUPPORT_URL="https://help.ubuntu.com/"
BUG_REPORT_URL="https://bugs.launchpad.net/ubuntu/"
PRIVACY_POLICY_URL="https://www.ubuntu.com/legal/terms-and-policies/privacy-policy"
VERSION_CODENAME=focal
UBUNTU_CODENAME=focal

- File of '/etc/cni/net.d/'
10-calico.conflist  calico.conflist.template  calico-kubeconfig  whereabouts.d

- File of '/etc/cni/multus/net.d'

- NetworkAttachment info (use `kubectl get net-attach-def -o yaml`)
apiVersion: v1
items:
- apiVersion: k8s.cni.cncf.io/v1
  kind: NetworkAttachmentDefinition
  metadata:
    creationTimestamp: "2022-03-17T03:34:04Z"
    generation: 1
    name: yockgen-network
    namespace: default
    resourceVersion: "51182"
    uid: 2f08a07b-9351-4a31-b8e4-b6e8873e3b13
  spec:
    config: '{ "cniVersion": "0.4.0", "name": "yockgen-network", "type": "macvlan",
      "master": "enp0s8", "mode": "bridge", "ipam": { "type": "whereabouts", "range":
      "192.168.15.225/28" } }'
kind: List
metadata:
  resourceVersion: ""
  selfLink: ""

- Target pod yaml info (with annotation, use `kubectl get pod <podname> -o yaml`)
apiVersion: v1
kind: Pod
metadata:
  annotations:
    cni.projectcalico.org/containerID: a7c83b514728455657f6a122a5335642377b282cfcf7d29614b72dbf0bdab204
    cni.projectcalico.org/podIP: 10.233.96.105/32
    cni.projectcalico.org/podIPs: 10.233.96.105/32
    k8s.v1.cni.cncf.io/network-status: |-
      [{
          "name": "cni0",
          "ips": [
              "10.233.96.105"
          ],
          "default": true,
          "dns": {}
      },{
          "name": "default/yockgen-network",
          "interface": "net1",
          "ips": [
              "192.168.15.225"
          ],
          "mac": "b2:ac:b9:55:e4:a4",
          "dns": {}
      }]
    k8s.v1.cni.cncf.io/networks: yockgen-network
    k8s.v1.cni.cncf.io/networks-status: |-
      [{
          "name": "cni0",
          "ips": [
              "10.233.96.105"
          ],
          "default": true,
          "dns": {}
      },{
          "name": "default/yockgen-network",
          "interface": "net1",
          "ips": [
              "192.168.15.225"
          ],
          "mac": "b2:ac:b9:55:e4:a4",
          "dns": {}
      }]
  creationTimestamp: "2022-03-17T03:34:28Z"
  generateName: test01-deployment-6f5b9549f9-
  labels:
    app: test01pod
    pod-template-hash: 6f5b9549f9
  name: test01-deployment-6f5b9549f9-mrvdt
  namespace: default
  ownerReferences:
  - apiVersion: apps/v1
    blockOwnerDeletion: true
    controller: true
    kind: ReplicaSet
    name: test01-deployment-6f5b9549f9
    uid: 31c9462a-53d5-4cbe-981a-9bfe9ddcbdc7
  resourceVersion: "51458"
  uid: 61344d79-17ce-4fb6-abed-d8672f7ee982
spec:
  containers:
  - command:
    - /bin/sleep
    - 3650d
    image: weibeld/ubuntu-networking
    imagePullPolicy: Always
    name: test01pod
    resources: {}
    securityContext:
      capabilities:
        add:
        - NET_ADMIN
        - SYS_TIME
        - NET_RAW
    terminationMessagePath: /dev/termination-log
    terminationMessagePolicy: File
    volumeMounts:
    - mountPath: /var/run/secrets/kubernetes.io/serviceaccount
      name: kube-api-access-r24sc
      readOnly: true
  dnsPolicy: ClusterFirst
  enableServiceLinks: true
  nodeName: node2
  preemptionPolicy: PreemptLowerPriority
  priority: 0
  restartPolicy: Always
  schedulerName: default-scheduler
  securityContext: {}
  serviceAccount: default
  serviceAccountName: default
  terminationGracePeriodSeconds: 30
  tolerations:
  - effect: NoExecute
    key: node.kubernetes.io/not-ready
    operator: Exists
    tolerationSeconds: 300
  - effect: NoExecute
    key: node.kubernetes.io/unreachable
    operator: Exists
    tolerationSeconds: 300
  volumes:
  - name: kube-api-access-r24sc
    projected:
      defaultMode: 420
      sources:
      - serviceAccountToken:
          expirationSeconds: 3607
          path: token
      - configMap:
          items:
          - key: ca.crt
            path: ca.crt
          name: kube-root-ca.crt
      - downwardAPI:
          items:
          - fieldRef:
              apiVersion: v1
              fieldPath: metadata.namespace
            path: namespace
status:
  conditions:
  - lastProbeTime: null
    lastTransitionTime: "2022-03-17T03:34:28Z"
    status: "True"
    type: Initialized
  - lastProbeTime: null
    lastTransitionTime: "2022-03-17T03:35:51Z"
    status: "True"
    type: Ready
  - lastProbeTime: null
    lastTransitionTime: "2022-03-17T03:35:51Z"
    status: "True"
    type: ContainersReady
  - lastProbeTime: null
    lastTransitionTime: "2022-03-17T03:34:28Z"
    status: "True"
    type: PodScheduled
  containerStatuses:
  - containerID: containerd://926747cc4055747666b5bcc602de9b95abab4b79a7437ff2825ac576fdf1c199
    image: docker.io/weibeld/ubuntu-networking:latest
    imageID: docker.io/weibeld/ubuntu-networking@sha256:62ad7ae70786fc7ff9a73cac1b0fe0a1811c0c617e65ceb45f16164524ccd18b
    lastState: {}
    name: test01pod
    ready: true
    restartCount: 0
    started: true
    state:
      running:
        startedAt: "2022-03-17T03:35:50Z"
  hostIP: 192.168.0.6
  phase: Running
  podIP: 10.233.96.105
  podIPs:
  - ip: 10.233.96.105
  qosClass: BestEffort
  startTime: "2022-03-17T03:34:28Z"

- Other log outputs (if you use multus logging)

**Comment by dougbtv** [comment]
It actually looks like the ping is completing successfully, there's a echo request and reply, but! `oui Unknown` seems to make sense here, since the mac address isn't a known one from a major provider, it's an unknown "organizational unique identifier" [oui].
