### ISSUE TITLE
pod to service on the same node: Connection reset by peer

### ISSUE THREAD

**Issue by zakkg3** [k8snetworkplumbingwg/multus-cni#565]
I have a mirror running with an nginx using a service with external ip.
From other nodes it works perfectly. Also If I have a pod with the native pod network in the same node it works ok.
But If i have a pod with only 1 interface (not the pod cdir, another bridge, with another vlan) on the same node (and only in the same node):

```yaml
  annotations:
    v1.multus-cni.io/default-network: namespace-name/net-attach-deff-name
```
Then it does not work:
```
root@debugtool:/# curl -I 10.206.151.15
curl: (56) Recv failure: Connection reset by peer
```

Here is the tcpdump on the node for this reseted connection

```
tcpdump host 10.206.151.15 -i any -vv
listening on any, link-type LINUX_SLL (Linux cooked), capture size 262144 bytes
11:35:09.177015 IP (tos 0x0, ttl 64, id 10466, offset 0, flags [DF], proto TCP (6), length 60)
    10.212.57.15.32796 > 10.206.151.15.80: Flags [S], cksum 0xe5ee (incorrect -> 0x9f92), seq 4221692964, win 62720, options [mss 8960,sackOK,TS val 3800589732 ecr 0,nop,wscale 7], length 0
11:35:09.177071 IP (tos 0x0, ttl 64, id 10466, offset 0, flags [DF], proto TCP (6), length 60)
    10.212.57.15.32796 > 10.206.151.15.80: Flags [S], cksum 0xe5ee (incorrect -> 0x9f92), seq 4221692964, win 62720, options [mss 8960,sackOK,TS val 3800589732 ecr 0,nop,wscale 7], length 0
11:35:09.177076 ethertype IPv4, IP (tos 0x0, ttl 64, id 10466, offset 0, flags [DF], proto TCP (6), length 60)
    10.212.57.15.32796 > 10.206.151.15.80: Flags [S], cksum 0xe5ee (incorrect -> 0x9f92), seq 4221692964, win 62720, options [mss 8960,sackOK,TS val 3800589732 ecr 0,nop,wscale 7], length 0
11:35:09.177084 ethertype IPv4, IP (tos 0x0, ttl 64, id 10466, offset 0, flags [DF], proto TCP (6), length 60)
    10.212.57.15.32796 > 10.206.151.15.80: Flags [S], cksum 0xe5ee (incorrect -> 0x9f92), seq 4221692964, win 62720, options [mss 8960,sackOK,TS val 3800589732 ecr 0,nop,wscale 7], length 0
11:35:09.177129 IP (tos 0x0, ttl 63, id 10466, offset 0, flags [DF], proto TCP (6), length 60)
    10.212.57.15.32796 > 10.206.151.15.80: Flags [S], cksum 0x9f92 (correct), seq 4221692964, win 62720, options [mss 8960,sackOK,TS val 3800589732 ecr 0,nop,wscale 7], length 0
11:35:09.177129 IP (tos 0x0, ttl 63, id 10466, offset 0, flags [DF], proto TCP (6), length 60)
    10.212.57.15.32796 > 10.206.151.15.80: Flags [S], cksum 0x9f92 (correct), seq 4221692964, win 62720, options [mss 8960,sackOK,TS val 3800589732 ecr 0,nop,wscale 7], length 0
11:35:09.177220 IP (tos 0x0, ttl 63, id 0, offset 0, flags [DF], proto TCP (6), length 60)
    10.206.151.15.80 > 10.212.57.15.32796: Flags [S.], cksum 0xe5ee (incorrect -> 0x8567), seq 3579222748, ack 4221692965, win 62636, options [mss 8960,sackOK,TS val 1811889723 ecr 3800589732,nop,wscale 7], length 0
11:35:09.177223 IP (tos 0x0, ttl 63, id 0, offset 0, flags [DF], proto TCP (6), length 60)
    10.206.151.15.80 > 10.212.57.15.32796: Flags [S.], cksum 0xe5ee (incorrect -> 0x8567), seq 3579222748, ack 4221692965, win 62636, options [mss 8960,sackOK,TS val 1811889723 ecr 3800589732,nop,wscale 7], length 0
11:35:09.177244 ethertype IPv4, IP (tos 0x0, ttl 62, id 0, offset 0, flags [DF], proto TCP (6), length 60)
    10.206.151.15.80 > 10.212.57.15.32796: Flags [S.], cksum 0x8567 (correct), seq 3579222748, ack 4221692965, win 62636, options [mss 8960,sackOK,TS val 1811889723 ecr 3800589732,nop,wscale 7], length 0
11:35:09.177321 IP (tos 0x0, ttl 63, id 10467, offset 0, flags [DF], proto TCP (6), length 52)
    10.212.57.15.32796 > 10.206.151.15.80: Flags [.], cksum 0xc441 (correct), seq 1, ack 1, win 490, options [nop,nop,TS val 3800589733 ecr 1811889723], length 0
11:35:09.177392 IP (tos 0x0, ttl 64, id 10468, offset 0, flags [DF], proto TCP (6), length 130)
    10.212.57.15.32796 > 10.206.151.15.80: Flags [P.], cksum 0xe634 (incorrect -> 0x6773), seq 1:79, ack 1, win 490, options [nop,nop,TS val 3800589733 ecr 1811889723], length 78: HTTP, length: 78
	HEAD / HTTP/1.1
	Host: 10.206.151.15
	User-Agent: curl/7.58.0
	Accept: */*

11:35:09.177524 IP (tos 0x0, ttl 63, id 1359, offset 0, flags [DF], proto TCP (6), length 52)
    10.206.151.15.84 > 10.212.57.15.32796: Flags [.], cksum 0xe5e6 (incorrect -> 0xc3f0), seq 3579222749, ack 4221693043, win 489, options [nop,nop,TS val 1811889723 ecr 3800589733], length 0
11:35:09.177528 IP (tos 0x0, ttl 63, id 1359, offset 0, flags [DF], proto TCP (6), length 52)
    10.206.151.15.84 > 10.212.57.15.32796: Flags [.], cksum 0xe5e6 (incorrect -> 0xc3f0), seq 0, ack 1, win 489, options [nop,nop,TS val 1811889723 ecr 3800589733], length 0
11:35:09.177561 ethertype IPv4, IP (tos 0x0, ttl 62, id 1359, offset 0, flags [DF], proto TCP (6), length 52)
    10.206.151.15.84 > 10.212.57.15.32796: Flags [.], cksum 0xc3f0 (correct), seq 0, ack 1, win 489, options [nop,nop,TS val 1811889723 ecr 3800589733], length 0
11:35:09.177626 IP (tos 0x0, ttl 64, id 0, offset 0, flags [DF], proto TCP (6), length 40)
    10.212.57.15.32796 > 10.206.151.15.476: Flags [R], cksum 0x6012 (correct), seq 4221693043, win 0, length 0
11:35:09.177635 IP (tos 0x0, ttl 64, id 0, offset 0, flags [DF], proto TCP (6), length 40)
    10.212.57.15.32796 > 10.206.151.15.84: Flags [R], cksum 0x619a (correct), seq 4221693043, win 0, length 0
11:35:09.177638 ethertype IPv4, IP (tos 0x0, ttl 64, id 0, offset 0, flags [DF], proto TCP (6), length 40)
    10.212.57.15.32796 > 10.206.151.15.84: Flags [R], cksum 0x619a (correct), seq 4221693043, win 0, length 0
11:35:09.177767 IP (tos 0x0, ttl 63, id 0, offset 0, flags [DF], proto TCP (6), length 40)
    10.212.57.15.32796 > 10.206.151.15.84: Flags [R], cksum 0x619a (correct), seq 4221693043, win 0, length 0
11:35:09.177767 IP (tos 0x0, ttl 63, id 0, offset 0, flags [DF], proto TCP (6), length 40)
    10.212.57.15.32796 > 10.206.151.15.84: Flags [R], cksum 0x619a (correct), seq 4221693043, win 0, length 0
11:35:09.177839 ethertype IPv4, IP (tos 0x0, ttl 62, id 1360, offset 0, flags [DF], proto TCP (6), length 207)
    10.206.151.15.84 > 10.212.57.15.32796: Flags [P.], cksum 0xa1ee (correct), seq 0:155, ack 1, win 489, options [nop,nop,TS val 1811889723 ecr 3800589733], length 155
11:35:09.177839 ethertype IPv4, IP (tos 0x0, ttl 62, id 1360, offset 0, flags [DF], proto TCP (6), length 207)
    10.206.151.15.84 > 10.212.57.15.32796: Flags [P.], cksum 0xa1ee (correct), seq 0:155, ack 1, win 489, options [nop,nop,TS val 1811889723 ecr 3800589733], length 155
11:35:09.177863 IP (tos 0x0, ttl 62, id 1360, offset 0, flags [DF], proto TCP (6), length 207)
    10.206.151.15.84 > 10.212.57.15.32796: Flags [P.], cksum 0xa1ee (correct), seq 0:155, ack 1, win 489, options [nop,nop,TS val 1811889723 ecr 3800589733], length 155
11:35:09.177880 IP (tos 0x0, ttl 64, id 0, offset 0, flags [DF], proto TCP (6), length 40)
    10.212.57.15.32796 > 10.206.151.15.84: Flags [R], cksum 0x619a (correct), seq 4221693043, win 0, length 0
11:35:09.177886 IP (tos 0x0, ttl 64, id 0, offset 0, flags [DF], proto TCP (6), length 40)
    10.212.57.15.32796 > 10.206.151.15.84: Flags [R], cksum 0x619a (correct), seq 4221693043, win 0, length 0
11:35:09.177982 IP (tos 0xc0, ttl 64, id 31134, offset 0, flags [none], proto ICMP (1), length 68)
    10.206.151.15 > 10.212.57.15: ICMP 10.206.151.15 tcp port 84 unreachable, length 48
	IP (tos 0x0, ttl 63, id 0, offset 0, flags [DF], proto TCP (6), length 40)
    10.212.57.15.32796 > 10.206.151.15.84: Flags [R], cksum 0x619a (correct), seq 4221693043, win 0, length 0
11:35:09.177987 IP (tos 0xc0, ttl 64, id 31134, offset 0, flags [none], proto ICMP (1), length 68)
    10.206.151.15 > 10.212.57.15: ICMP 10.206.151.15 tcp port 84 unreachable, length 48
	IP (tos 0x0, ttl 63, id 0, offset 0, flags [DF], proto TCP (6), length 40)
    10.212.57.15.32796 > 10.206.151.15.84: Flags [R], cksum 0x619a (correct), seq 4221693043, win 0, length 0
11:35:09.178019 ethertype IPv4, IP (tos 0xc0, ttl 63, id 31134, offset 0, flags [none], proto ICMP (1), length 68)
    10.206.151.15 > 10.212.57.15: ICMP 10.206.151.15 tcp port 84 unreachable, length 48
	IP (tos 0x0, ttl 63, id 0, offset 0, flags [DF], proto TCP (6), length 40)
    10.212.57.15.32796 > 10.206.151.15.84: Flags [R], cksum 0x619a (correct), seq 4221693043, win 0, length 0
11:35:09.178019 ethertype IPv4, IP (tos 0xc0, ttl 63, id 31134, offset 0, flags [none], proto ICMP (1), length 68)
    10.206.151.15 > 10.212.57.15: ICMP 10.206.151.15 tcp port 84 unreachable, length 48
	IP (tos 0x0, ttl 63, id 0, offset 0, flags [DF], proto TCP (6), length 40)
    10.212.57.15.32796 > 10.206.151.15.84: Flags [R], cksum 0x619a (correct), seq 4221693043, win 0, length 0
11:35:09.383350 IP (tos 0x0, ttl 64, id 10469, offset 0, flags [DF], proto TCP (6), length 130)
    10.212.57.15.32796 > 10.206.151.15.80: Flags [P.], cksum 0xe634 (incorrect -> 0x66a5), seq 1:79, ack 1, win 490, options [nop,nop,TS val 3800589939 ecr 1811889723], length 78: HTTP, length: 78
	HEAD / HTTP/1.1
	Host: 10.206.151.15
	User-Agent: curl/7.58.0
	Accept: */*

11:35:09.383388 IP (tos 0x0, ttl 64, id 10469, offset 0, flags [DF], proto TCP (6), length 130)
    10.212.57.15.32796 > 10.206.151.15.80: Flags [P.], cksum 0xe634 (incorrect -> 0x66a5), seq 1:79, ack 1, win 490, options [nop,nop,TS val 3800589939 ecr 1811889723], length 78: HTTP, length: 78
	HEAD / HTTP/1.1
	Host: 10.206.151.15
	User-Agent: curl/7.58.0
	Accept: */*

11:35:09.383390 ethertype IPv4, IP (tos 0x0, ttl 64, id 10469, offset 0, flags [DF], proto TCP (6), length 130)
    10.212.57.15.32796 > 10.206.151.15.80: Flags [P.], cksum 0xe634 (incorrect -> 0x66a5), seq 1:79, ack 1, win 490, options [nop,nop,TS val 3800589939 ecr 1811889723], length 78: HTTP, length: 78
	HEAD / HTTP/1.1
	Host: 10.206.151.15
	User-Agent: curl/7.58.0
	Accept: */*

11:35:09.383394 ethertype IPv4, IP (tos 0x0, ttl 64, id 10469, offset 0, flags [DF], proto TCP (6), length 130)
    10.212.57.15.32796 > 10.206.151.15.80: Flags [P.], cksum 0xe634 (incorrect -> 0x66a5), seq 1:79, ack 1, win 490, options [nop,nop,TS val 3800589939 ecr 1811889723], length 78: HTTP, length: 78
	HEAD / HTTP/1.1
	Host: 10.206.151.15
	User-Agent: curl/7.58.0
	Accept: */*

11:35:09.383437 IP (tos 0x0, ttl 63, id 10469, offset 0, flags [DF], proto TCP (6), length 130)
    10.212.57.15.32796 > 10.206.151.15.80: Flags [P.], cksum 0x66a5 (correct), seq 1:79, ack 1, win 490, options [nop,nop,TS val 3800589939 ecr 1811889723], length 78: HTTP, length: 78
	HEAD / HTTP/1.1
	Host: 10.206.151.15
	User-Agent: curl/7.58.0
	Accept: */*

11:35:09.383437 IP (tos 0x0, ttl 63, id 10469, offset 0, flags [DF], proto TCP (6), length 130)
    10.212.57.15.32796 > 10.206.151.15.80: Flags [P.], cksum 0x66a5 (correct), seq 1:79, ack 1, win 490, options [nop,nop,TS val 3800589939 ecr 1811889723], length 78: HTTP, length: 78
	HEAD / HTTP/1.1
	Host: 10.206.151.15
	User-Agent: curl/7.58.0
	Accept: */*

11:35:09.383502 IP (tos 0x0, ttl 63, id 0, offset 0, flags [DF], proto TCP (6), length 40)
    10.206.151.15.80 > 10.212.57.15.32796: Flags [R], cksum 0xd97f (correct), seq 3579222749, win 0, length 0
11:35:09.383506 IP (tos 0x0, ttl 63, id 0, offset 0, flags [DF], proto TCP (6), length 40)
    10.206.151.15.80 > 10.212.57.15.32796: Flags [R], cksum 0xd97f (correct), seq 3579222749, win 0, length 0

```

Seems to me its doing some weird DNAT conntrack translations here...

Did someone experienced something similar? any hint?

```
kubectl version
Client Version: version.Info{Major:"1", Minor:"18", GitVersion:"v1.18.3", GitCommit:"2e7996e3e2712684bc73f0dec0200d64eec7fe40", GitTreeState:"clean", BuildDate:"2020-05-21T14:51:23Z", GoVersion:"go1.14.3", Compiler:"gc", Platform:"darwin/amd64"}
Server Version: version.Info{Major:"1", Minor:"17", GitVersion:"v1.17.4", GitCommit:"8d8aa39598534325ad77120c120a22b3a990b5ea", GitTreeState:"clean", BuildDate:"2020-03-12T20:55:23Z", GoVersion:"go1.13.8", Compiler:"gc", Platform:"linux/amd64"}
```

```
multus:v3.4.1
```

**Comment by dougbtv** [comment]
@zakkg3 could you provide the contents of the net-attach-def?

also... regarding:

> with only 1 interface (not the pod cdir, another bridge, with another vlan)

if it's only one interface, is it just the default network? Or "with only one *additional* interface"?

Also, I think an `ip a` and an `ip route` on the pods that have been effected would be helpful too. Thanks!

**Comment by zakkg3** [comment]
The pod have only 1 interface, no default k8s podCIdr network., but a multus one.
```
k exec -it debugtool -n test -- bash
root@debugtool:/# ip a
1: lo: <LOOPBACK,UP,LOWER_UP> mtu 65536 qdisc noqueue state UNKNOWN group default qlen 1000
    link/loopback 00:00:00:00:00:00 brd 00:00:00:00:00:00
    inet 127.0.0.1/8 scope host lo
       valid_lft forever preferred_lft forever
    inet6 ::1/128 scope host
       valid_lft forever preferred_lft forever
3: eth0@if774: <BROADCAST,MULTICAST,UP,LOWER_UP> mtu 9000 qdisc noqueue state UP group default
    link/ether 2a:b5:f4:6d:46:f7 brd ff:ff:ff:ff:ff:ff link-netnsid 0
    inet 10.212.57.15/21 scope global eth0
       valid_lft forever preferred_lft forever
    inet6 fe80::28b5:f4ff:fe6d:46f7/64 scope link
       valid_lft forever preferred_lft forever
```

```
root@debugtool:/# ip route
default via 10.212.56.1 dev eth0
10.212.56.0/21 dev eth0 proto kernel scope link src 10.212.57.15
```

Net attach def:
```
apiVersion: k8s.cni.cncf.io/v1
kind: NetworkAttachmentDefinition
metadata:
  name: access
  namespace: tenant-test
spec:
  config: '{"cniVersion": "0.3.1", "type": "bridge", "bridge": "bridge.9999", "mtu":
    9000, "ipam": {"type": "whereabouts", "datastore": "kubernetes", "kubernetes":
    {"kubeconfig": "/etc/cni/net.d/whereabouts.d/whereabouts.kubeconfig"}, "range":
    "10.212.56.0/21", "gateway": "10.212.56.1", "range_start": "10.212.57.0", "range_end":
    "10.212.57.255", "routes": [{"dst": "0.0.0.0/0", "gw": "10.212.56.1"}], "dns":
    {"nameservers": ["10.212.57.0"], "domain": "XX.com", "search": ["XX.com",
    "XX.com", "XX.com"]}}}''
```

the service i can not reach (external ip - routed to the cluster).
```
k get svc -n mirror
NAME           TYPE        CLUSTER-IP      EXTERNAL-IP     PORT(S)          AGE
mirror-nginx   ClusterIP   10.206.150.71   10.206.151.15   80/TCP,443/TCP   120d
```

It only happens with a pod running in worker 2 trying to reach a pod running in the same worker. any other combination works.
ping works (I guess something else is responding here) but curl does not work (it works in same pod running in another node)

```
root@debugtool:/# ping 10.206.151.15
PING 10.206.151.15 (10.206.151.15) 56(84) bytes of data.
64 bytes from 10.206.151.15: icmp_seq=1 ttl=63 time=0.233 ms
64 bytes from 10.206.151.15: icmp_seq=2 ttl=63 time=0.190 ms
64 bytes from 10.206.151.15: icmp_seq=3 ttl=63 time=0.207 ms
^C
--- 10.206.151.15 ping statistics ---
3 packets transmitted, 3 received, 0% packet loss, time 2028ms
rtt min/avg/max/mdev = 0.190/0.210/0.233/0.017 ms
root@debugtool:/# curl 10.206.151.15
curl: (56) Recv failure: Connection reset by peer
```

**Comment by dougbtv** [comment]
May I suggest that they provision the bridge manually -- e.g. create on the node(s), and then refer to the bridge name in the CNI configuration for bridge -- it will use the already created bridge.

This will allow you to test the connectivity of the bridge to other services.

**Comment by zakkg3** [comment]
Thats the case, i create the bridges before  with this script:

```
#!/bin/bash

cat <<EOT > /etc/network/interfaces.d/bridge_biomedit-test.conf
auto bridge.2023
iface bridge.2023 inet manual
   bridge_ports access.2023
   mtu 9000
EOT
ifup bridge.2023 || true
```

and clush to all the cluster.
