### ISSUE TITLE
Eth0 failing if adding specific netowrk attachment

### ISSUE THREAD

**Issue by elgamal2020** [k8snetworkplumbingwg/multus-cni#664]
**What happend**:

I am seeing a very strange behavior, seems a software bug , so when I add secondary network attachment mastered by specific interfaces “ens161 and ens162” , I lost the connectivity to eth0 of the pod , and it is shown as failed in the ip monitor 

I am seeing a very strange behavior, seems a software bug , so when I add secondary network attachment mastered by specific interfaces “ens161 and ens162” , I lost the connectivity to eth0 of the pod , and it is shown as failed in the ip monitor 

Environment : 

```
kubectl get nodes -o wide
NAME         STATUS   ROLES    AGE   VERSION   INTERNAL-IP   EXTERNAL-IP   OS-IMAGE             KERNEL-VERSION     CONTAINER-RUNTIME
esmad0sl02   Ready    master   10d   v1.19.2   10.2.22.170   <none>        Ubuntu 20.04.1 LTS   5.4.0-42-generic   docker://19.3.13
esmad0sl03   Ready    master   10d   v1.19.2   10.2.22.171   <none>        Ubuntu 20.04.1 LTS   5.4.0-42-generic   docker://19.3.13
esmad0sl04   Ready    master   10d   v1.19.2   10.2.22.172   <none>        Ubuntu 20.04.1 LTS   5.4.0-42-generic   docker://19.3.13

```

interfaces on the host :
```

ip a s
1: lo: <LOOPBACK,UP,LOWER_UP> mtu 65536 qdisc noqueue state UNKNOWN group default qlen 1000
    link/loopback 00:00:00:00:00:00 brd 00:00:00:00:00:00
    inet 127.0.0.1/8 scope host lo
       valid_lft forever preferred_lft forever
    inet6 ::1/128 scope host
       valid_lft forever preferred_lft forever
2: ens161: <BROADCAST,MULTICAST,UP,LOWER_UP> mtu 1500 qdisc mq state UP group default qlen 1000
    link/ether 00:50:56:a3:59:9b brd ff:ff:ff:ff:ff:ff
    inet 10.2.17.172/24 brd 10.2.17.255 scope global ens161
       valid_lft forever preferred_lft forever
    inet6 fe80::250:56ff:fea3:599b/64 scope link
       valid_lft forever preferred_lft forever
3: ens162: <BROADCAST,MULTICAST,UP,LOWER_UP> mtu 1500 qdisc mq state UP group default qlen 1000
    link/ether 00:50:56:a3:92:0e brd ff:ff:ff:ff:ff:ff
    inet 10.2.26.172/24 brd 10.2.26.255 scope global ens162
       valid_lft forever preferred_lft forever
    inet6 fe80::250:56ff:fea3:920e/64 scope link
       valid_lft forever preferred_lft forever
4: ens192: <BROADCAST,MULTICAST,UP,LOWER_UP> mtu 1500 qdisc mq state UP group default qlen 1000
    link/ether 00:50:56:a3:c3:cd brd ff:ff:ff:ff:ff:ff
    inet 10.2.22.172/24 brd 10.2.22.255 scope global ens192
       valid_lft forever preferred_lft forever
    inet6 fe80::250:56ff:fea3:c3cd/64 scope link
       valid_lft forever preferred_lft forever
5: ens193: <BROADCAST,MULTICAST,UP,LOWER_UP> mtu 1500 qdisc mq state UP group default qlen 1000
    link/ether 00:50:56:a3:6d:01 brd ff:ff:ff:ff:ff:ff
    inet 10.2.16.172/24 brd 10.2.16.255 scope global ens193
       valid_lft forever preferred_lft forever
    inet6 fe80::250:56ff:fea3:6d01/64 scope link
       valid_lft forever preferred_lft forever
6: ens224: <BROADCAST,MULTICAST,UP,LOWER_UP> mtu 1500 qdisc mq state UP group default qlen 1000
    link/ether 00:50:56:a3:fa:b6 brd ff:ff:ff:ff:ff:ff
    inet 10.2.23.172/24 brd 10.2.23.255 scope global ens224
       valid_lft forever preferred_lft forever
    inet6 fe80::250:56ff:fea3:fab6/64 scope link
       valid_lft forever preferred_lft forever
7: ens225: <BROADCAST,MULTICAST,UP,LOWER_UP> mtu 1500 qdisc mq state UP group default qlen 1000
    link/ether 00:50:56:a3:cd:68 brd ff:ff:ff:ff:ff:ff
    inet 10.2.24.172/24 brd 10.2.24.255 scope global ens225
       valid_lft forever preferred_lft forever
    inet6 fe80::250:56ff:fea3:cd68/64 scope link
       valid_lft forever preferred_lft forever
8: ens256: <BROADCAST,MULTICAST,UP,LOWER_UP> mtu 1500 qdisc mq state UP group default qlen 1000
    link/ether 00:50:56:a3:ce:84 brd ff:ff:ff:ff:ff:ff
    inet 10.2.15.172/24 brd 10.2.15.255 scope global ens256
       valid_lft forever preferred_lft forever
    inet6 fe80::250:56ff:fea3:ce84/64 scope link
       valid_lft forever preferred_lft forever
9: ens257: <BROADCAST,MULTICAST,UP,LOWER_UP> mtu 1500 qdisc mq state UP group default qlen 1000
    link/ether 00:50:56:a3:5d:0b brd ff:ff:ff:ff:ff:ff
    inet 10.2.25.172/24 brd 10.2.25.255 scope global ens257
       valid_lft forever preferred_lft forever
    inet6 fe80::250:56ff:fea3:5d0b/64 scope link
       valid_lft forever preferred_lft forever


```
so what is quite odd that those two interfaces are shown as interface 1 and 2 while the Kuberentes NW for eth0 is interface 3 
Can the order be the issue ? , appreciating much your help and support 

Steps to reproduce. 
```

cat nad161 # Netowrk attachement Yaml
apiVersion: k8s.cni.cncf.io/v1
kind: NetworkAttachmentDefinition
metadata:
  name: ens161
spec:
  config: '{ "cniVersion": "0.3.1", "plugins": [ { "type": "ipvlan", "mas

```
```
cat busy161 # pod Yaml
apiVersion: v1
kind: Pod
metadata:
  labels:
    app: pod161
  name: pod161
  annotations:
    k8s.v1.cni.cncf.io/networks: '[
      {"name":
      "ens161","interface": "hamada","ips": ["10.2.17.181/24"]}
      ]'
spec:
  affinity:
    nodeAffinity:
      requiredDuringSchedulingIgnoredDuringExecution:
        nodeSelectorTerms:
        - matchExpressions:
          - key: nti-node-type
            operator: In
            values:
            - tdb-tsp
  terminationGracePeriodSeconds: 0
  hostAliases:
  - hostnames:
    - ens161
    ip: 10.2.17.181
  containers:
  - name: busybox
    image: titan-ium-artifacts.netnumber.com/busybox:1.32.0
    args:
    - sleep
    - "1000000"
    securityContext:
      privileged: true
      allowPrivilegeEscalation: true
    env:
    - name: NNI_POD_IP
      valueFrom:
        fieldRef:
          fieldPath: status.podIP
    - name: NNI_APP_PORT
      value: "80"
  restartPolicy: Always

```
```
kubectl apply -f nad161
networkattachmentdefinition.k8s.cni.cncf.io/ens161 created
kubectl apply -f busy161
pod/pod161 created
kubectl get pods -o wide
NAME     READY   STATUS    RESTARTS   AGE   IP              NODE         NOMINATED NODE   READINESS GATES
pod161   1/1     Running   0          37s   10.233.85.112   esmad0sl04   <none>           <none>

```
i```
nterfaces and routes on the pod 

```

kubectl exec pod161 -- ip a s
1: lo: <LOOPBACK,UP,LOWER_UP> mtu 65536 qdisc noqueue qlen 1000
    link/loopback 00:00:00:00:00:00 brd 00:00:00:00:00:00
    inet 127.0.0.1/8 scope host lo
       valid_lft forever preferred_lft forever
3: eth0@if272: <BROADCAST,MULTICAST,UP,LOWER_UP,M-DOWN> mtu 1500 qdisc noqueue
    link/ether c2:a6:9b:33:2a:cb brd ff:ff:ff:ff:ff:ff
    inet 10.233.85.112/32 brd 10.233.85.112 scope global eth0
       valid_lft forever preferred_lft forever
4: hamada@if2: <BROADCAST,MULTICAST,UP,LOWER_UP,M-DOWN> mtu 1500 qdisc noqueue
    link/ether 00:50:56:a3:59:9b brd ff:ff:ff:ff:ff:ff
    inet 10.2.17.181/24 brd 10.2.17.255 scope global hamada
       valid_lft forever preferred_lft forever
kubectl exec pod161 -- ip r
default via 169.254.1.1 dev eth0
10.2.17.0/24 dev hamada scope link  src 10.2.17.181
169.254.1.1 dev eth0 scope link
```
```

```
then run ip monitor in the hosting node esmad0sl04   
```

ip monitor all | grep FAIL
[NEIGH]10.233.85.95 dev califac420b0ff3  FAILED
[NEIGH]10.233.85.95 dev califac420b0ff3  FAILED
[NEIGH]10.233.85.95 dev califac420b0ff3  FAILED
```

`Also  the ping shows it go through ens161 while it should go through ens192
```
`ping 10.233.85.112
PING 10.233.85.112 (10.233.85.112) 56(84) bytes of data.
From 10.2.17.172 icmp_seq=1 Destination Host Unreachable
```

If I disable the interface ens161, the ping turns successful

 

I tried to change the routes, applying default routes, deleting the routes from the host but nothing works 
I didn’t succeed to change the order of interface numbering and I don’t know on what it depends. 

I am really appreciating much your help. 

**Environment**:

- Multus version 
  image path and image ID (from 'docker images')
9b13777edc63

- Kubernetes version (use `kubectl version`):
- 1.19.2
- Primary CNI for Kubernetes cluster:
Calico 
- OS (e.g. from /etc/os-release):
- File of '/etc/cni/net.d/'
- File of '/etc/cni/multus/net.d'
- NetworkAttachment info (use `kubectl get net-attach-def -o yaml`)
- Target pod yaml info (with annotation, use `kubectl get pod <podname> -o yaml`)
- Other log outputs (if you use multus logging)

```

**Comment by dougbtv** [comment]
The fact that it works when you disable the `ens161` interface on the host points to the possibility of something wrong with networking on the host.

The actions that Multus takes aren't related to any type of changing of networking on the host, nor on the primary default network interface on the pod, `eth0` inside the pod. In fact, Multus promises to plumb your eth0 every time (to ensure k8s functionality as promised, too)

So... something I'd recommend doing is:

1. Check this on another machine / lab environment to see if you can replicate it.
2. Try using a different reference CNI plugin to plumb the interfaces, e.g. change out ipvlan for macvlan or bridge etc.
3. Then try some packet captures at each point along the way to see where it is.

**Comment by elgamal2020** [comment]
Thanks Douglas for your answer 

1. It happens on two separate environments 
2. I have to use ipvlan for this use-case 
3. here is the packet captured 


Once ping issued 
```

esmad0sl04:~$ ping 10.233.85.71
PING 10.233.85.71 (10.233.85.71) 56(84) bytes of data.
From 10.2.17.172 icmp_seq=1 Destination Host Unreachable
From 10.2.17.172 icmp_seq=2 Destination Host Unreachable
From 10.2.17.172 icmp_seq=3 Destination Host Unreachable
From 10.2.17.172 icmp_seq=4 Destination Host Unreachable
From 10.2.17.172 icmp_seq=5 Destination Host Unreachable
From 10.2.17.172 icmp_seq=6 Destination Host Unreachable
From 10.2.17.172 icmp_seq=7 Destination Host Unreachable
From 10.2.17.172 icmp_seq=8 Destination Host Unreachable
From 10.2.17.172 icmp_seq=9 Destination Host Unreachable
```


on the calico interface of the pod , I can see ARP requests 

```
sudo tcpdump -i cali19f73d6d879 -vv
tcpdump: listening on cali19f73d6d879, link-type EN10MB (Ethernet), capture size 262144 bytes
05:09:39.499353 ARP, Ethernet (len 6), IPv4 (len 4), Request who-has 10.233.85.71 tell esmad0sl04, length 28
05:09:40.528161 ARP, Ethernet (len 6), IPv4 (len 4), Request who-has 10.233.85.71 tell esmad0sl04, length 28
05:09:41.552189 ARP, Ethernet (len 6), IPv4 (len 4), Request who-has 10.233.85.71 tell esmad0sl04, length 28
05:09:42.576529 ARP, Ethernet (len 6), IPv4 (len 4), Request who-has 10.233.85.71 tell esmad0sl04, length 28
05:09:43.600170 ARP, Ethernet (len 6), IPv4 (len 4), Request who-has 10.233.85.71 tell esmad0sl04, length 28
05:09:44.628171 ARP, Ethernet (len 6), IPv4 (len 4), Request who-has 10.233.85.71 tell esmad0sl04, length 28
05:09:45.648277 ARP, Ethernet (len 6), IPv4 (len 4), Request who-has 10.233.85.71 tell esmad0sl04, length 28
05:09:46.672168 ARP, Ethernet (len 6), IPv4 (len 4), Request who-has 10.233.85.71 tell esmad0sl04, length 28
05:09:47.696168 ARP, Ethernet (len 6), IPv4 (len 4), Request who-has 10.233.85.71 tell esmad0sl04, length 28
05:09:48.720323 ARP, Ethernet (len 6), IPv4 (len 4), Request who-has 10.233.85.71 tell esmad0sl04, length 28
05:09:49.744156 ARP, Ethernet (len 6), IPv4 (len 4), Request who-has 10.233.85.71 tell esmad0sl04, length 28
05:09:50.768158 ARP, Ethernet (len 6), IPv4 (len 4), Request who-has 10.233.85.71 tell esmad0sl04, length 28
```


on ens161 which is the master for the ipvlan attachment , nothing is showing 

```
sudo tcpdump -i ens161 -vv
tcpdump: listening on ens161, link-type EN10MB (Ethernet), capture size 262144 bytes
```

and on the interface ens192 which has the cluster network , nothing related is shown 

on any , I can see the ICMP packets and those unreachable 

```
sudo tcpdump -i any -vv | grep -i icmp
tcpdump: listening on any, link-type LINUX_SLL (Linux cooked v1), capture size 262144 bytes
05:21:50.832242 IP (tos 0xc0, ttl 64, id 45053, offset 0, flags [none], proto ICMP (1), length 112)
    esmad0sl04 > esmad0sl04: ICMP host 10.233.85.71 unreachable, length 92
        IP (tos 0x0, ttl 64, id 60404, offset 0, flags [DF], proto ICMP (1), length 84)
    esmad0sl04 > 10.233.85.71: ICMP echo request, id 25, seq 340, length 64
05:21:53.904205 IP (tos 0xc0, ttl 64, id 45665, offset 0, flags [none], proto ICMP (1), length 112)
    esmad0sl04 > esmad0sl04: ICMP host 10.233.85.71 unreachable, length 92
        IP (tos 0x0, ttl 64, id 60633, offset 0, flags [DF], proto ICMP (1), length 84)
    esmad0sl04 > 10.233.85.71: ICMP echo request, id 25, seq 343, length 64
05:21:53.904214 IP (tos 0xc0, ttl 64, id 45666, offset 0, flags [none], proto ICMP (1), length 112)
    esmad0sl04 > esmad0sl04: ICMP host 10.233.85.71 unreachable, length 92
        IP (tos 0x0, ttl 64, id 60772, offset 0, flags [DF], proto ICMP (1), length 84)
    esmad0sl04 > 10.233.85.71: ICMP echo request, id 25, seq 344, length 64
05:21:56.976243 IP (tos 0xc0, ttl 64, id 46181, offset 0, flags [none], proto ICMP (1), length 112)
    esmad0sl04 > esmad0sl04: ICMP host 10.233.85.71 unreachable, length 92
        IP (tos 0x0, ttl 64, id 60817, offset 0, flags [DF], proto ICMP (1), length 84)
    esmad0sl04 > 10.233.85.71: ICMP echo request, id 25, seq 345, length 64
05:21:56.976252 IP (tos 0xc0, ttl 64, id 46182, offset 0, flags [none], proto ICMP (1), length 112)
    esmad0sl04 > esmad0sl04: ICMP host 10.233.85.71 unreachable, length 92
        IP (tos 0x0, ttl 64, id 60980, offset 0, flags [DF], proto ICMP (1), length 84)
    esmad0sl04 > 10.233.85.71: ICMP echo request, id 25, seq 346, length 64
05:21:56.976259 IP (tos 0xc0, ttl 64, id 46183, offset 0, flags [none], proto ICMP (1), length 112)
    esmad0sl04 > esmad0sl04: ICMP host 10.233.85.71 unreachable, length 92
        IP (tos 0x0, ttl 64, id 61064, offset 0, flags [DF], proto ICMP (1), length 84)
    esmad0sl04 > 10.233.85.71: ICMP echo request, id 25, seq 347, length 64
05:22:00.048217 IP (tos 0xc0, ttl 64, id 46711, offset 0, flags [none], proto ICMP (1), length 112)
    esmad0sl04 > esmad0sl04: ICMP host 10.233.85.71 unreachable, length 92
        IP (tos 0x0, ttl 64, id 61173, offset 0, flags [DF], proto ICMP (1), length 84)
    esmad0sl04 > 10.233.85.71: ICMP echo request, id 25, seq 348, length 64
05:22:00.048234 IP (tos 0xc0, ttl 64, id 46712, offset 0, flags [none], proto ICMP (1), length 112)
    esmad0sl04 > esmad0sl04: ICMP host 10.233.85.71 unreachable, length 92
        IP (tos 0x0, ttl 64, id 61300, offset 0, flags [DF], proto ICMP (1), length 84)
    esmad0sl04 > 10.233.85.71: ICMP echo request, id 25, seq 349, length 64
05:22:00.048244 IP (tos 0xc0, ttl 64, id 46713, offset 0, flags [none], proto ICMP (1), length 112)
    esmad0sl04 > esmad0sl04: ICMP host 10.233.85.71 unreachable, length 92
        IP (tos 0x0, ttl 64, id 61448, offset 0, flags [DF], proto ICMP (1), length 84)
    esmad0sl04 > 10.233.85.71: ICMP echo request, id 25, seq 350, length 64
05:22:03.120203 IP (tos 0xc0, ttl 64, id 47050, offset 0, flags [none], proto ICMP (1), length 112)
    esmad0sl04 > esmad0sl04: ICMP host 10.233.85.71 unreachable, length 92
        IP (tos 0x0, ttl 64, id 61665, offset 0, flags [DF], proto ICMP (1), length 84)
    esmad0sl04 > 10.233.85.71: ICMP echo request, id 25, seq 351, length 64
05:22:03.120214 IP (tos 0xc0, ttl 64, id 47051, offset 0, flags [none], proto ICMP (1), length 112)
    esmad0sl04 > esmad0sl04: ICMP host 10.233.85.71 unreachable, length 92
        IP (tos 0x0, ttl 64, id 61895, offset 0, flags [DF], proto ICMP (1), length 84)
    esmad0sl04 > 10.233.85.71: ICMP echo request, id 25, seq 352, length 64
05:22:03.120222 IP (tos 0xc0, ttl 64, id 47052, offset 0, flags [none], proto ICMP (1), length 112)
    esmad0sl04 > esmad0sl04: ICMP host 10.233.85.71 unreachable, length 92
        IP (tos 0x0, ttl 64, id 62087, offset 0, flags [DF], proto ICMP (1), length 84)
    esmad0sl04 > 10.233.85.71: ICMP echo request, id 25, seq 353, length 64
```



if I disable ens161 

I can see the ICMP packets at the calico interface 

  esmad0sl04 > 10.233.85.71: ICMP echo request, id 25, seq 1, length 64
05:16:01.644438 ARP, Ethernet (len 6), IPv4 (len 4), Request who-has 169.254.1.1 tell 10.233.85.71, length 28
05:16:01.644442 ARP, Ethernet (len 6), IPv4 (len 4), Reply 169.254.1.1 is-at ee:ee:ee:ee:ee:ee (oui Unknown), length 28
05:16:01.644445 IP (tos 0x0, ttl 64, id 21865, offset 0, flags [none], proto ICMP (1), length 84)
    10.233.85.71 > esmad0sl04: ICMP echo reply, id 25, seq 1, length 64
05:16:02.672223 IP (tos 0x0, ttl 64, id 58436, offset 0, flags [DF], proto ICMP (1), length 84)
    esmad0sl04 > 10.233.85.71: ICMP echo request, id 25, seq 2, length 64
05:16:02.672264 IP (tos 0x0, ttl 64, id 21993, offset 0, flags [none], proto ICMP (1), length 84)
    10.233.85.71 > esmad0sl04: ICMP echo reply, id 25, seq 2, length 64
05:16:03.696244 IP (tos 0x0, ttl 64, id 58546, offset 0, flags [DF], proto ICMP (1), length 84)
    esmad0sl04 > 10.233.85.71: ICMP echo request, id 25, seq 3, length 64
05:16:03.696282 IP (tos 0x0, ttl 64, id 22133, offset 0, flags [none], proto ICMP (1), length 84)
    10.233.85.71 > esmad0sl04: ICMP echo reply, id 25, seq 3, length 64
05:16:04.720215 IP (tos 0x0, ttl 64, id 58718, offset 0, flags [DF], proto ICMP (1), length 84)
    esmad0sl04 > 10.233.85.71: ICMP echo request, id 25, seq 4, length 64




```

 sudo tcpdump -i any -vv | grep -i icmp
tcpdump: listening on any, link-type LINUX_SLL (Linux cooked v1), capture size 262144 bytes
05:24:03.856223 IP (tos 0x0, ttl 64, id 12449, offset 0, flags [DF], proto ICMP (1), length 84)
    esmad0sl04 > 10.233.85.71: ICMP echo request, id 25, seq 472, length 64
05:24:03.856244 IP (tos 0x0, ttl 64, id 6403, offset 0, flags [none], proto ICMP (1), length 84)
    10.233.85.71 > esmad0sl04: ICMP echo reply, id 25, seq 472, length 64
05:24:04.884272 IP (tos 0x0, ttl 64, id 12509, offset 0, flags [DF], proto ICMP (1), length 84)
    esmad0sl04 > 10.233.85.71: ICMP echo request, id 25, seq 473, length 64
05:24:04.884293 IP (tos 0x0, ttl 64, id 6496, offset 0, flags [none], proto ICMP (1), length 84)
    10.233.85.71 > esmad0sl04: ICMP echo reply, id 25, seq 473, length 64
05:24:05.904250 IP (tos 0x0, ttl 64, id 12655, offset 0, flags [DF], proto ICMP (1), length 84)
    esmad0sl04 > 10.233.85.71: ICMP echo request, id 25, seq 474, length 64
05:24:05.904278 IP (tos 0x0, ttl 64, id 6624, offset 0, flags [none], proto ICMP (1), length 84)
    10.233.85.71 > esmad0sl04: ICMP echo reply, id 25, seq 474, length 64
05:24:06.928214 IP (tos 0x0, ttl 64, id 12864, offset 0, flags [DF], proto ICMP (1), length 84)
    esmad0sl04 > 10.233.85.71: ICMP echo request, id 25, seq 475, length 64
05:24:06.928236 IP (tos 0x0, ttl 64, id 6693, offset 0, flags [none], proto ICMP (1), length 84)
    10.233.85.71 > esmad0sl04: ICMP echo reply, id 25, seq 475, length 64
05:24:07.952210 IP (tos 0x0, ttl 64, id 13111, offset 0, flags [DF], proto ICMP (1), length 84)
    esmad0sl04 > 10.233.85.71: ICMP echo request, id 25, seq 476, length 64
05:24:07.952228 IP (tos 0x0, ttl 64, id 6874, offset 0, flags [none], proto ICMP (1), length 84)
    10.233.85.71 > esmad0sl04: ICMP echo reply, id 25, seq 476, length 64
05:24:08.976212 IP (tos 0x0, ttl 64, id 13291, offset 0, flags [DF], proto ICMP (1), length 84)
    esmad0sl04 > 10.233.85.71: ICMP echo request, id 25, seq 477, length 64
05:24:08.976237 IP (tos 0x0, ttl 64, id 6914, offset 0, flags [none], proto ICMP (1), length 84)
    10.233.85.71 > esmad0sl04: ICMP echo reply, id 25, seq 477, length 64
05:24:10.004208 IP (tos 0x0, ttl 64, id 13526, offset 0, flags [DF], proto ICMP (1), length 84)
    esmad0sl04 > 10.233.85.71: ICMP echo request, id 25, seq 478, length 64
05:24:10.004248 IP (tos 0x0, ttl 64, id 6967, offset 0, flags [none], proto ICMP (1), length 84)
    10.233.85.71 > esmad0sl04: ICMP echo reply, id 25, seq 478, length 64

```


Is there any other packets to capture ?

**Comment by elgamal2020** [comment]
I found a workaround by applying SBR 
```
apiVersion: k8s.cni.cncf.io/v1
kind: NetworkAttachmentDefinition
metadata:
  name: ens161
spec:
  config: '{ "cniVersion": "0.3.1", "plugins": [ { "type": "ipvlan", "master": "ens161",
    "capabilities": { "ips": true }, "ipam": { "type": "static" } }, { "type": "sbr" } ] }'
```

Should I apply SBR all times using multus ?

**Comment by dougbtv** [comment]
I don't think so.

Our e2e test looks at connectivity and this looks related to your setup in
particular, so generally: no. To your specific setup: maybe.

**Comment by elgamal2020** [comment]
Thanks a lot Douglas , so if we focus on the case without the SBR WA 
Is there any further troubleshooting we can do , packet captures , etc ?

The environment is built on vSphere VMs , and there are already number of issues that has been opened on vsphere 

The problem only happens on two interface ens161 and ens162 which are before ens192 "interface hosting the cluster NW" , can this order be the problem ? 

```

 ip a s | grep ens
2: ens161: <BROADCAST,MULTICAST> mtu 1500 qdisc mq state DOWN group default qlen 1000
3: ens162: <BROADCAST,MULTICAST,UP,LOWER_UP> mtu 1500 qdisc mq state UP group default qlen 1000
    inet 10.2.26.172/24 brd 10.2.26.255 scope global ens162
4: ens192: <BROADCAST,MULTICAST,UP,LOWER_UP> mtu 1500 qdisc mq state UP group default qlen 1000
    inet 10.2.22.172/24 brd 10.2.22.255 scope global ens192
5: ens193: <BROADCAST,MULTICAST,UP,LOWER_UP> mtu 1500 qdisc mq state UP group default qlen 1000
    inet 10.2.16.172/24 brd 10.2.16.255 scope global ens193
6: ens224: <BROADCAST,MULTICAST,UP,LOWER_UP> mtu 1500 qdisc mq state UP group default qlen 1000
    inet 10.2.23.172/24 brd 10.2.23.255 scope global ens224
7: ens225: <BROADCAST,MULTICAST,UP,LOWER_UP> mtu 1500 qdisc mq state UP group default qlen 1000
    inet 10.2.24.172/24 brd 10.2.24.255 scope global ens225
8: ens256: <BROADCAST,MULTICAST,UP,LOWER_UP> mtu 1500 qdisc mq state UP group default qlen 1000
    inet 10.2.15.172/24 brd 10.2.15.255 scope global ens256
9: ens257: <BROADCAST,MULTICAST,UP,LOWER_UP> mtu 1500 qdisc mq state UP group default qlen 1000
    inet 10.2.25.172/24 brd 10.2.25.255 scope global ens257
```


Note: OS is ubuntu 20.04 


Thanks again , appreciating much your support and efforts for the community @dougbtv

**Comment by s1061123** [comment]
Hi, could you please show me the following information?

- host routing table (master, worker)
- pod routing table

**Comment by s1061123** [comment]
in addition, appreciate if you get two kinds of pod routing table, with sbr plugin and without sbr plugin.

**Comment by elgamal2020** [comment]
Thanks a lot @s1061123  , appreciating much your support 


The cluster is composed of 3 VMs (Master/worker)
```

:~$ kubectl get nodes  -o wide
NAME         STATUS   ROLES    AGE   VERSION   INTERNAL-IP   EXTERNAL-IP   OS-IMAGE             KERNEL-VERSION     CONTAINER-RUNTIME
esmad0sl02   Ready    master   16d   v1.19.2   10.2.22.170   <none>        Ubuntu 20.04.1 LTS   5.4.0-42-generic   docker://19.3.13
esmad0sl03   Ready    master   16d   v1.19.2   10.2.22.171   <none>        Ubuntu 20.04.1 LTS   5.4.0-42-generic   docker://19.3.13
esmad0sl04   Ready    master   16d   v1.19.2   10.2.22.172   <none>        Ubuntu 20.04.1 LTS   5.4.0-42-generic   docker://19.3.13

```

Here below thier ip tables 

```
esmad0sl02 sudo ip r
default via 10.2.23.1 dev ens224 proto static
10.2.15.0/24 dev ens256 proto kernel scope link src 10.2.15.170
10.2.22.0/24 dev ens192 proto kernel scope link src 10.2.22.170
10.2.23.0/24 dev ens224 proto kernel scope link src 10.2.23.170
10.233.84.0 dev cali37ab5bebf94 scope link
blackhole 10.233.84.0/24 proto bird
10.233.84.1 dev cali4b0be4db682 scope link
10.233.84.2 dev cali6ac6f75bfae scope link
10.233.84.167 dev cali693f36bd372 scope link
10.233.84.168 dev calif76f239b6cb scope link
10.233.84.171 dev cali9f51b4e5693 scope link
10.233.84.172 dev cali7f8e6e2b0cd scope link
10.233.85.0/24 via 10.2.22.172 dev ens192 proto bird
10.233.86.0/24 via 10.2.22.171 dev ens192 proto bird
172.17.0.0/16 dev docker0 proto kernel scope link src 172.17.0.1 linkdown

esmad0sl03:~$ sudo ip r
default via 10.2.23.1 dev ens224 proto static
10.2.15.0/24 dev ens256 proto kernel scope link src 10.2.15.171
10.2.16.0/24 dev ens161 proto kernel scope link src 10.2.16.171
10.2.17.0/24 dev ens193 proto kernel scope link src 10.2.17.171
10.2.22.0/24 dev ens192 proto kernel scope link src 10.2.22.171
10.2.23.0/24 dev ens224 proto kernel scope link src 10.2.23.171
10.2.24.0/24 dev ens225 proto kernel scope link src 10.2.24.171
10.2.25.0/24 dev ens257 proto kernel scope link src 10.2.25.171
10.2.26.0/24 dev ens162 proto kernel scope link src 10.2.26.171
10.233.84.0/24 via 10.2.22.170 dev ens192 proto bird
10.233.85.0/24 via 10.2.22.172 dev ens192 proto bird
10.233.86.0 dev calibb04551a169 scope link
blackhole 10.233.86.0/24 proto bird
10.233.86.1 dev califef7ecbfbcd scope link
10.233.86.2 dev cali83396686d8e scope link
10.233.86.3 dev calibb3847d036a scope link
10.233.86.4 dev cali818390d6166 scope link
10.233.86.125 dev cali13fed1a572b scope link
10.233.86.127 dev cali7f57eca5e3c scope link
10.233.86.128 dev cali7729ee898ef scope link
10.233.86.129 dev calid2849b1a132 scope link
10.233.86.238 dev cali90dc09428ad scope link
10.233.86.240 dev cali39d2ef233e8 scope link
10.233.86.242 dev cali8f45af6f870 scope link
10.233.86.243 dev cali2a148a8cd0e scope link
172.17.0.0/16 dev docker0 proto kernel scope link src 172.17.0.1 linkdown


esmad0sl04:~$ sudo ip r
default via 10.2.23.1 dev ens224 proto static
10.2.15.0/24 dev ens256 proto kernel scope link src 10.2.15.172
10.2.16.0/24 dev ens193 proto kernel scope link src 10.2.16.172
10.2.22.0/24 dev ens192 proto kernel scope link src 10.2.22.172
10.2.23.0/24 dev ens224 proto kernel scope link src 10.2.23.172
10.2.24.0/24 dev ens225 proto kernel scope link src 10.2.24.172
10.2.25.0/24 dev ens257 proto kernel scope link src 10.2.25.172
10.2.26.0/24 dev ens162 proto kernel scope link src 10.2.26.172
10.233.84.0/24 via 10.2.22.170 dev ens192 proto bird
blackhole 10.233.85.0/24 proto bird
10.233.85.71 dev cali19f73d6d879 scope link
10.233.85.93 dev cali9ce76f69370 scope link
10.233.85.166 dev cali4392e6d191f scope link
10.233.85.167 dev calicdde9529bfe scope link
10.233.85.168 dev caliaad227c77ea scope link
10.233.85.170 dev cali4f2452520c8 scope link
10.233.85.171 dev calia5754d25737 scope link
10.233.85.174 dev cali5264b60a098 scope link
10.233.85.176 dev cali6efd6b2c953 scope link
10.233.85.178 dev calic4b16c1e64b scope link
10.233.85.179 dev calibf7364d6530 scope link
10.233.86.0/24 via 10.2.22.171 dev ens192 proto bird
172.17.0.0/16 dev docker0 proto kernel scope link src 172.17.0.1 linkdown

```

Pod route table without SBR

```
kubectl exec pod161 -- ip r list
default via 169.254.1.1 dev eth0
10.2.17.0/24 dev hamada scope link  src 10.2.17.181
169.254.1.1 dev eth0 scope link


kubectl exec pod161 -- ip route show table local
broadcast 10.2.17.0 dev hamada scope link  src 10.2.17.181
local 10.2.17.181 dev hamada scope host  src 10.2.17.181
broadcast 10.2.17.255 dev hamada scope link  src 10.2.17.181
local 10.233.85.71 dev eth0 scope host  src 10.233.85.71
broadcast 10.233.85.71 dev eth0 scope link  src 10.233.85.71
broadcast 127.0.0.0 dev lo scope link  src 127.0.0.1
local 127.0.0.0/8 dev lo scope host  src 127.0.0.1
local 127.0.0.1 dev lo scope host  src 127.0.0.1
broadcast 127.255.255.255 dev lo scope link  src 127.0.0.1
nnadmin@esmad0sl04:~$ kubectl exec pod161 -- ip route show table 100
nnadmin@esmad0sl04:~$ kubectl exec pod161 -- netstat -rn
Kernel IP routing table
Destination     Gateway         Genmask         Flags   MSS Window  irtt Iface
0.0.0.0         169.254.1.1     0.0.0.0         UG        0 0          0 eth0
10.2.17.0       0.0.0.0         255.255.255.0   U         0 0          0 hamada
169.254.1.1     0.0.0.0         255.255.255.255 UH        0 0          0 eth0


```

With SBR 

```

kubectl exec pod161 -- ip route show table local
broadcast 10.2.17.0 dev hamada scope link  src 10.2.17.181
local 10.2.17.181 dev hamada scope host  src 10.2.17.181
broadcast 10.2.17.255 dev hamada scope link  src 10.2.17.181
local 10.233.86.249 dev eth0 scope host  src 10.233.86.249
broadcast 10.233.86.249 dev eth0 scope link  src 10.233.86.249
broadcast 127.0.0.0 dev lo scope link  src 127.0.0.1
local 127.0.0.0/8 dev lo scope host  src 127.0.0.1
local 127.0.0.1 dev lo scope host  src 127.0.0.1
broadcast 127.255.255.255 dev lo scope link  src 127.0.0.1
~$ kubectl exec pod161 -- ip route show table 100
10.2.17.0/24 dev hamada scope link  src 10.2.17.181
:~$ kubectl exec pod161 -- netstat -rn
Kernel IP routing table
Destination     Gateway         Genmask         Flags   MSS Window  irtt Iface
0.0.0.0         169.254.1.1     0.0.0.0         UG        0 0          0 eth0
169.254.1.1     0.0.0.0         255.255.255.255 UH        0 0          0 eth0
```






Another , I found may be useful , without SBR but on another interface ens225 which is working which is working without the need of applying SBR 

```

cat nad225
apiVersion: k8s.cni.cncf.io/v1
kind: NetworkAttachmentDefinition
metadata:
  name: ens225
spec:
  config: '{ "cniVersion": "0.3.1", "plugins": [ { "type": "ipvlan", "master": "ens225",
    "capabilities": { "ips": true }, "ipam": { "type": "static" } } ] }'


$ cat busy225


apiVersion: v1
kind: Pod
metadata:
  labels:
    app: pod225
  name: pod225
  annotations:
    k8s.v1.cni.cncf.io/networks: '[
      {"name":
      "ens225","interface": "hamada","ips": ["10.2.24.181/24"]}
      ]'
spec:
  affinity:
    nodeAffinity:
      requiredDuringSchedulingIgnoredDuringExecution:
        nodeSelectorTerms:
        - matchExpressions:
          - key: nti-node-type
            operator: In
            values:
            - tdb-tsp
  terminationGracePeriodSeconds: 0
  hostAliases:
  - hostnames:
    - ens225
    ip: 10.2.24.181
  containers:
  - name: busybox
    image: busybox:1.32.0
    args:
    - sleep
    - "1000000"
    securityContext:
      privileged: true
      allowPrivilegeEscalation: true
    env:
    - name: NNI_POD_IP
      valueFrom:
        fieldRef:
          fieldPath: status.podIP
    - name: NNI_APP_PORT
      value: "80"
  restartPolicy: Always

```

```
kubectl get pods -o wide
NAME     READY   STATUS    RESTARTS   AGE     IP              NODE         NOMINATED NODE   READINESS GATES
pod161   1/1     Running   0          5m55s   10.233.86.249   esmad0sl03   <none>           <none>
pod225   1/1     Running   0          76s     10.233.86.250   esmad0sl03   <none>           <none>


kubectl get pods -o wide
NAME     READY   STATUS    RESTARTS   AGE     IP              NODE         NOMINATED NODE   READINESS GATES
pod161   1/1     Running   0          5m55s   10.233.86.249   esmad0sl03   <none>           <none>
pod225   1/1     Running   0          76s     10.233.86.250   esmad0sl03   <none>           <none>

:~$ kubectl exec pod225 -- ip r
default via 169.254.1.1 dev eth0
10.2.24.0/24 dev hamada scope link  src 10.2.24.181
169.254.1.1 dev eth0 scope link

:~$ kubectl exec pod225 -- ip a s
1: lo: <LOOPBACK,UP,LOWER_UP> mtu 65536 qdisc noqueue qlen 1000
    link/loopback 00:00:00:00:00:00 brd 00:00:00:00:00:00
    inet 127.0.0.1/8 scope host lo
       valid_lft forever preferred_lft forever
3: eth0@if372: <BROADCAST,MULTICAST,UP,LOWER_UP,M-DOWN> mtu 1500 qdisc noqueue
    link/ether 8e:e5:f4:15:fb:95 brd ff:ff:ff:ff:ff:ff
    inet 10.233.86.250/32 brd 10.233.86.250 scope global eth0
       valid_lft forever preferred_lft forever
4: hamada@if7: <BROADCAST,MULTICAST,UP,LOWER_UP,M-DOWN> mtu 1500 qdisc noqueue
    link/ether 00:50:56:a3:6f:4a brd ff:ff:ff:ff:ff:ff
    inet 10.2.24.181/24 brd 10.2.24.255 scope global hamada
       valid_lft forever preferred_lft forever

~$ kubectl exec pod225 -- netstat -rn
Kernel IP routing table
Destination     Gateway         Genmask         Flags   MSS Window  irtt Iface
0.0.0.0         169.254.1.1     0.0.0.0         UG        0 0          0 eth0
10.2.24.0       0.0.0.0         255.255.255.0   U         0 0          0 hamada
169.254.1.1     0.0.0.0         255.255.255.255 UH        0 0          0 eth0

$ kubectl exec pod225 -- ip route show table local
broadcast 10.2.24.0 dev hamada scope link  src 10.2.24.181
local 10.2.24.181 dev hamada scope host  src 10.2.24.181
broadcast 10.2.24.255 dev hamada scope link  src 10.2.24.181
local 10.233.86.250 dev eth0 scope host  src 10.233.86.250
broadcast 10.233.86.250 dev eth0 scope link  src 10.233.86.250
broadcast 127.0.0.0 dev lo scope link  src 127.0.0.1
local 127.0.0.0/8 dev lo scope host  src 127.0.0.1
local 127.0.0.1 dev lo scope host  src 127.0.0.1
broadcast 127.255.255.255 dev lo scope link  src 127.0.0.1
~$ kubectl exec pod225 -- ip route show table 100

```

**Comment by s1061123** [comment]
Thank you for your information and update. From multus-cni's point of view, this is not multus issue, it comes from network configuration (e.g. routing) in your lab. I'm not good at calico, however, I've heard that calico uses routing mainly for networking, so I guess some routing needs to be changed. 

Multus could run any CNI plugins, however, it does not guarantee all plugins combination. Some plugin combination may cause some error due to each plugins specification.

@dougbtv any comments?

**Comment by elgamal2020** [comment]
Thanks a lot @s1061123  

I would like to ask you some few questions 

1) Are there any drawback of the source based routing ?
2) would you see the order of the interface as a potential reason of the issue ?
3) Would Multus enable me to indicate different route metrics ?
4) Is there any further troubleshooting , some route insights from the host or the pod that might be useful for the troubleshooting ?

Thanks a lot
Best Regards

**Comment by s1061123** [comment]
1. From CNI point of view, there is nothing, but I'm not good at linux kernel networking. You may need to ask linux kernel community for that.
2. interface order (of `ip a`) shows 'ifindex' of linux kernel. If some program uses fixed ifindex number, it might be issue. Please check your app.
3. https://github.com/redhat-nfvpe/cni-route-override could be candidate, but it does not support sbr. With sbr, you may need to change route inside pod (with privilege)
4. Currently no perfect way for that. Mainly 'ip'/'route' commands help to troubleshooting.

**Comment by s1061123** [comment]
@elgamal2020 If you don't mind, we'd like to close this issue for now. But we're watching on the threads so of course, okey to add more comment in it.
