### ISSUE TITLE
POD has second network/IP but no connectivity

### ISSUE THREAD

**Issue by helioaymoto** [k8snetworkplumbingwg/multus-cni#390]
Hi,

I have a Kubernet Cluster with Flannel.
I have deployed Multus sucessfully and I can create a POD with the 2nd network interface... seems to be fine in the pod as I can see net1 and the IP address correctelly assigned, but I cannot access no one from the net1 interface or neither from outside of the pod to the pod via the 2nd network interface.

I am pretty much new on this, so could you indicate a way to debug this in order to figure out where the problem is?

Thanks.

Here is some details about my environment:
1) Kubernet version
```
[helio@kub-1 ~]$ kubectl version
Client Version: version.Info{Major:"1", Minor:"16", GitVersion:"v1.16.0", GitCommit:"2bd9643cee5b3b3a5ecbd3af49d09018f0773c77", GitTreeState:"clean", BuildDate:"2019-09-18T14:36:53Z", GoVersion:"go1.12.9", Compiler:"gc", Platform:"linux/amd64"}
Server Version: version.Info{Major:"1", Minor:"14", GitVersion:"v1.14.6", GitCommit:"96fac5cd13a5dc064f7d9f4f23030a6aeface6cc", GitTreeState:"clean", BuildDate:"2019-08-19T11:05:16Z", GoVersion:"go1.12.9", Compiler:"gc", Platform:"linux/amd64"}
```
2) Kubernet nodes
```
[helio@kub-1 ~]$ kubectl get nodes
NAME            STATUS   ROLES                      AGE   VERSION
192.168.52.78   Ready    controlplane,etcd,worker   20m   v1.14.6
192.168.52.79   Ready    controlplane,etcd,worker   20m   v1.14.6
192.168.52.80   Ready    controlplane,etcd,worker   20m   v1.14.6
```
3) Multus daemon-set:
```
[helio@kub-1 ~]$ kubectl get pods --all-namespaces | grep -i multus
kube-system     kube-multus-ds-amd64-jdfmm                1/1     Running     0          10m
kube-system     kube-multus-ds-amd64-nchp2                1/1     Running     0          10m
kube-system     kube-multus-ds-amd64-slmbv                1/1     Running     0          10m
```
4) The network attachment definitions:
```
[helio@kub-1 ~]$ kubectl get network-attachment-definitions
NAME           AGE
macvlan-conf   10m

[helio@kub-1 ~]$ kubectl describe network-attachment-definitions macvlan-conf
Name:         macvlan-conf
Namespace:    default
Labels:       <none>
Annotations:  <none>
API Version:  k8s.cni.cncf.io/v1
Kind:         NetworkAttachmentDefinition
Metadata:
  Creation Timestamp:  2019-10-07T13:58:27Z
  Generation:          1
  Resource Version:    1893
  Self Link:           /apis/k8s.cni.cncf.io/v1/namespaces/default/network-attachment-definitions/macvlan-conf
  UID:                 8938bb65-e90a-11e9-b2aa-00505684386a
Spec:
  Config:  { "cniVersion": "0.3.1", "type": "macvlan", "master": "ens192", "mode": "bridge", "ipam": { "type": "host-local", "subnet": "192.168.52.0/24", "rangeStart": "192.168.52.220", "rangeEnd": "192.168.52.230", "routes": [ { "dst": "0.0.0.0/0" } ], "gateway": "192.168.52.1" } }
Events:    <none>
```

5) My Kubernet nodes Network:
```
[helio@kub-1 ~]$ ip a
:
2: ens192: <BROADCAST,MULTICAST,UP,LOWER_UP> mtu 1500 qdisc mq state UP group default qlen 1000
    link/ether 00:50:56:84:e9:d4 brd ff:ff:ff:ff:ff:ff
    inet 192.168.52.78/24 brd 192.168.52.255 scope global noprefixroute ens192
       valid_lft forever preferred_lft forever
    inet6 fe80::2f77:7b78:8371:4ffc/64 scope link tentative noprefixroute dadfailed
       valid_lft forever preferred_lft forever
    inet6 fe80::418:afbd:66a0:b130/64 scope link tentative noprefixroute dadfailed
       valid_lft forever preferred_lft forever
    inet6 fe80::7e24:fd10:343f:e914/64 scope link noprefixroute
       valid_lft forever preferred_lft forever
```

6) The POD using macvlan-conf:
```
[helio@kub-1 ~]$ kubectl get pods
NAME        READY   STATUS    RESTARTS   AGE
samplepod   1/1     Running   0          12m
[helio@kub-1 ~]$ kubectl exec -it samplepod -- bash

[root@samplepod /]# ip a
1: lo: <LOOPBACK,UP,LOWER_UP> mtu 65536 qdisc noqueue state UNKNOWN qlen 1000
    link/loopback 00:00:00:00:00:00 brd 00:00:00:00:00:00
    inet 127.0.0.1/8 scope host lo
       valid_lft forever preferred_lft forever
3: eth0@if33: <BROADCAST,MULTICAST,UP,LOWER_UP> mtu 1450 qdisc noqueue state UP
    link/ether 0a:58:0a:2a:00:03 brd ff:ff:ff:ff:ff:ff link-netnsid 0
    inet 10.42.0.3/24 scope global eth0
       valid_lft forever preferred_lft forever
4: net1@if2: <BROADCAST,MULTICAST,UP,LOWER_UP> mtu 1500 qdisc noqueue state UNKNOWN
    link/ether a2:f8:30:95:81:a8 brd ff:ff:ff:ff:ff:ff link-netnsid 0
    inet 192.168.52.220/24 scope global net1
       valid_lft forever preferred_lft forever
```

7) Trying to ping Default GW and Kubernet nodes:
```
[root@samplepod /]# ping 192.168.52.1
PING 192.168.52.1 (192.168.52.1) 56(84) bytes of data.
From 192.168.52.220 icmp_seq=10 Destination Host Unreachable
From 192.168.52.220 icmp_seq=11 Destination Host Unreachable
From 192.168.52.220 icmp_seq=12 Destination Host Unreachable

[root@samplepod /]# ping 192.168.52.78
PING 192.168.52.78 (192.168.52.78) 56(84) bytes of data.
From 192.168.52.220 icmp_seq=1 Destination Host Unreachable
From 192.168.52.220 icmp_seq=2 Destination Host Unreachable
From 192.168.52.220 icmp_seq=3 Destination Host Unreachable

[root@samplepod /]# ssh tecnotree@192.168.52.78

ssh: connect to host 192.168.52.78 port 22: No route to host

```

8) Netstat in the POD:
```
[root@samplepod /]# netstat -rn
Kernel IP routing table
Destination     Gateway         Genmask         Flags   MSS Window  irtt Iface
0.0.0.0         10.42.0.1       0.0.0.0         UG        0 0          0 eth0
10.42.0.0       0.0.0.0         255.255.255.0   U         0 0          0 eth0
10.42.0.0       10.42.0.1       255.255.0.0     UG        0 0          0 eth0
192.168.52.0    0.0.0.0         255.255.255.0   U         0 0          0 net1
```

**Comment by dougbtv** [comment]
Hi @helioaymoto -- do you have the `master` field of the macvlan-conf (from the quickstart guide) set as `ens192` -- to match the network interface name of your host?

Also do you mind pasting your macvlan-conf? Thanks!

**Comment by helioaymoto** [comment]
Hi @dougbtv,
yes, the master field was set to ens192 which is the network interface on the nodes/hosts....

```
[helio@kub-1 helio]$ cat network.yaml
apiVersion: "k8s.cni.cncf.io/v1"
kind: NetworkAttachmentDefinition
metadata:
  name: macvlan-conf
spec:
  config: '{
      "cniVersion": "0.3.1",
      "type": "macvlan",
      "master": "ens192",
      "mode": "bridge",
      "ipam": {
        "type": "host-local",
        "subnet": "192.168.52.0/24",
        "rangeStart": "192.168.52.220",
        "rangeEnd": "192.168.52.230",
        "routes": [
          { "dst": "0.0.0.0/0" }
        ],
        "gateway": "192.168.52.1"
      }
    }'
``` 
You can also see in the describe of the network-attachement:
```
[helio@kub-1 ~]$ kubectl describe network-attachment-definitions macvlan-conf
Name:         macvlan-conf
Namespace:    default
Labels:       <none>
Annotations:  <none>
API Version:  k8s.cni.cncf.io/v1
Kind:         NetworkAttachmentDefinition
Metadata:
  Creation Timestamp:  2019-10-07T13:58:27Z
  Generation:          1
  Resource Version:    1893
  Self Link:           /apis/k8s.cni.cncf.io/v1/namespaces/default/network-attachment-definitions/macvlan-conf
  UID:                 8938bb65-e90a-11e9-b2aa-00505684386a
Spec:
  Config:  { "cniVersion": "0.3.1", "type": "macvlan", "master": "ens192", "mode": "bridge", "ipam": { "type": "host-local", "subnet": "192.168.52.0/24", "rangeStart": "192.168.52.220", "rangeEnd": "192.168.52.230", "routes": [ { "dst": "0.0.0.0/0" } ], "gateway": "192.168.52.1" } }
Events:    <none>
```

Thank you.

**Comment by Elegant996** [comment]
That sounds right, you have no route to `192.168.52.1`. I haven't set this up in awhile but if I recall, when you `ping` it uses the default route:

```
Destination     Gateway         Genmask         Flags   MSS Window  irtt Iface
0.0.0.0         10.42.0.1       0.0.0.0         UG        0 0          0 eth0
```

In this case,  you are using `eth0` to ping `192.168.52.1` and not `net1`. In order to ping that address using `net1`, you would use `ping -I net1 192.168.52.1` or `ping -I 192.168.52.220 192.168.52.1`. This should allow you to ping the gateway.

That being said, you will have another issue, how do you communicate with your subnet?

```
Destination     Gateway         Genmask         Flags   MSS Window  irtt Iface
192.168.52.0    0.0.0.0         255.255.255.0   U         0 0          0 net1
```

Based on the above, you will use the default gateway to communicate with `192.168.52.0/24` which would be through `10.42.0.1`. This would mean any request destined for the aforementioned subnet will be routed through the `eth0` gateway. This is probably not what you intend as `192.168.52.1` is much more practical.

In order to achieve this, you would want to use a separate routing table. The best way to implement this would be to chain the [sbr](https://github.com/containernetworking/plugins/tree/master/plugins/meta/sbr) plugin which will take care of this for you.

Hope this helps. Thanks!

**Comment by helioaymoto** [comment]
Hi @Elegant996 ,

I don't that's the problem...  I mean, I tried to ping using the option that you have commented, but it is still the same... I cannot ping/access anyone from the net1 NIC.

I have just made a test...
The original Kubernet where I am having issue was built in 3 VMs which are running in a ESX Cluster in my company.... and as I have indicated before the POD is getting the 2nd NIC (net1) and IP address, but I cannot access anyone outside of the using the 2nd NIC.

I have just instaled a new Kubernet Cluster... using the exactelly the same configuration but in 3 VMs which I have build locally in my Notebook using VMWare Workstation.... and using exactelly all the same configuration for the kubernet and for Multus configuration, I could get the 2nd NIC working and pinging outside using the 2nd NIC (net1).

Kubernet Cluster running in VMs in my notebook:
```
[root@samplepod /]# ip a
1: lo: <LOOPBACK,UP,LOWER_UP> mtu 65536 qdisc noqueue state UNKNOWN qlen 1000
    link/loopback 00:00:00:00:00:00 brd 00:00:00:00:00:00
    inet 127.0.0.1/8 scope host lo
       valid_lft forever preferred_lft forever
3: eth0@if38: <BROADCAST,MULTICAST,UP,LOWER_UP> mtu 1450 qdisc noqueue state UP
    link/ether 0a:58:0a:2a:00:04 brd ff:ff:ff:ff:ff:ff link-netnsid 0
    inet 10.42.0.4/24 scope global eth0
       valid_lft forever preferred_lft forever
4: net1@if2: <BROADCAST,MULTICAST,UP,LOWER_UP> mtu 1500 qdisc noqueue state UNKNOWN
    link/ether b2:f2:de:25:5a:0e brd ff:ff:ff:ff:ff:ff link-netnsid 0
    inet 192.168.1.40/24 scope global net1
       valid_lft forever preferred_lft forever
[root@samplepod /]# netstat -rn
Kernel IP routing table
Destination     Gateway         Genmask         Flags   MSS Window  irtt Iface
0.0.0.0         10.42.0.1       0.0.0.0         UG        0 0          0 eth0
10.42.0.0       0.0.0.0         255.255.255.0   U         0 0          0 eth0
10.42.0.0       10.42.0.1       255.255.0.0     UG        0 0          0 eth0
192.168.1.0     0.0.0.0         255.255.255.0   U         0 0          0 net1
[root@samplepod /]# ping 192.168.1.1
PING 192.168.1.1 (192.168.1.1) 56(84) bytes of data.
64 bytes from 192.168.1.1: icmp_seq=1 ttl=64 time=13.7 ms
64 bytes from 192.168.1.1: icmp_seq=2 ttl=64 time=16.6 ms
^C
--- 192.168.1.1 ping statistics ---
2 packets transmitted, 2 received, 0% packet loss, time 1002ms
rtt min/avg/max/mdev = 13.766/15.195/16.625/1.434 ms
```

Kubernet Cluster running in a VM running on VMWARE ESX:
```
[root@samplepod /]# ip a
1: lo: <LOOPBACK,UP,LOWER_UP> mtu 65536 qdisc noqueue state UNKNOWN qlen 1000
    link/loopback 00:00:00:00:00:00 brd 00:00:00:00:00:00
    inet 127.0.0.1/8 scope host lo
       valid_lft forever preferred_lft forever
3: eth0@if176: <BROADCAST,MULTICAST,UP,LOWER_UP> mtu 1450 qdisc noqueue state UP
    link/ether 0a:58:0a:2a:00:92 brd ff:ff:ff:ff:ff:ff link-netnsid 0
    inet 10.42.0.146/24 scope global eth0
       valid_lft forever preferred_lft forever
4: net1@if2: <BROADCAST,MULTICAST,UP,LOWER_UP> mtu 1500 qdisc noqueue state UNKNOWN
    link/ether 16:5a:bd:cf:a8:93 brd ff:ff:ff:ff:ff:ff link-netnsid 0
    inet 192.168.52.225/24 scope global net1
       valid_lft forever preferred_lft forever
[root@samplepod /]# ping 192.168.52.1
PING 192.168.52.1 (192.168.52.1) 56(84) bytes of data.
From 192.168.52.225 icmp_seq=10 Destination Host Unreachable
From 192.168.52.225 icmp_seq=11 Destination Host Unreachable
From 192.168.52.225 icmp_seq=12 Destination Host Unreachable
```

The only different between both setup are the Network range and the Network interface.
In the working kubernet I am using:
```
$ kubectl describe network-attachment-definitions macvlan-conf
Name:         macvlan-conf
Namespace:    default
Labels:       <none>
Annotations:  <none>
API Version:  k8s.cni.cncf.io/v1
Kind:         NetworkAttachmentDefinition
Metadata:
  Creation Timestamp:  2019-10-16T02:28:26Z
  Generation:          1
  Resource Version:    1276
  Self Link:           /apis/k8s.cni.cncf.io/v1/namespaces/default/network-attachment-definitions/macvlan-conf
  UID:                 a23cf2a1-efbc-11e9-8639-000c2970a5eb
Spec:
  Config:  { "cniVersion": "0.3.0", "type": "macvlan", "master": "ens33", "mode": "bridge", "ipam": { "type": "host-local", "subnet": "192.168.1.0/24", "rangeStart": "192.168.1.40", "rangeEnd": "192.168.1.50", "routes": [ { "dst": "0.0.0.0/0" } ], "gateway": "192.168.1.1" } }
Events:    <none>
[helio@kubernet-1 ~]$ ip a
1: lo: <LOOPBACK,UP,LOWER_UP> mtu 65536 qdisc noqueue state UNKNOWN group default qlen 1000
    link/loopback 00:00:00:00:00:00 brd 00:00:00:00:00:00
    inet 127.0.0.1/8 scope host lo
       valid_lft forever preferred_lft forever
    inet6 ::1/128 scope host
       valid_lft forever preferred_lft forever
2: ens33: <BROADCAST,MULTICAST,UP,LOWER_UP> mtu 1500 qdisc pfifo_fast state UP group default qlen 1000
    link/ether 00:0c:29:7f:42:73 brd ff:ff:ff:ff:ff:ff
    inet 192.168.1.161/24 brd 192.168.1.255 scope global noprefixroute ens33
       valid_lft forever preferred_lft forever
    inet6 fe80::6147:9627:e90d:4f03/64 scope link noprefixroute
       valid_lft forever preferred_lft forever
```

and in the NOT working kubernet Cluster:
```
[helio@kub-1 ~]$ kubectl describe network-attachment-definitions macvlan-conf
Name:         macvlan-conf
Namespace:    default
Labels:       <none>
Annotations:  <none>
API Version:  k8s.cni.cncf.io/v1
Kind:         NetworkAttachmentDefinition
Metadata:
  Creation Timestamp:  2019-10-15T17:21:52Z
  Generation:          1
  Resource Version:    761232
  Self Link:           /apis/k8s.cni.cncf.io/v1/namespaces/default/network-attachment-definitions/macvlan-conf
  UID:                 47912ff0-ef70-11e9-9769-00505684386a
Spec:
  Config:  { "cniVersion": "0.3.0", "type": "macvlan", "master": "ens192", "mode": "bridge", "ipam": { "type": "host-local", "subnet": "192.168.52.0/24", "rangeStart": "192.168.52.220", "rangeEnd": "192.168.52.230", "routes": [ { "dst": "0.0.0.0/0" } ], "gateway": "192.168.52.1" } }
Events:    <none>
[helio@kub-1 ~]$ ip a
1: lo: <LOOPBACK,UP,LOWER_UP> mtu 65536 qdisc noqueue state UNKNOWN group default qlen 1000
    link/loopback 00:00:00:00:00:00 brd 00:00:00:00:00:00
    inet 127.0.0.1/8 scope host lo
       valid_lft forever preferred_lft forever
    inet6 ::1/128 scope host
       valid_lft forever preferred_lft forever
2: ens192: <BROADCAST,MULTICAST,UP,LOWER_UP> mtu 1500 qdisc mq state UP group default qlen 1000
    link/ether 00:50:56:84:e9:d4 brd ff:ff:ff:ff:ff:ff
    inet 192.168.52.78/24 brd 192.168.52.255 scope global noprefixroute ens192
       valid_lft forever preferred_lft forever
    inet6 fe80::2f77:7b78:8371:4ffc/64 scope link tentative noprefixroute dadfailed
       valid_lft forever preferred_lft forever
    inet6 fe80::418:afbd:66a0:b130/64 scope link tentative noprefixroute dadfailed
       valid_lft forever preferred_lft forever
    inet6 fe80::7e24:fd10:343f:e914/64 scope link noprefixroute
       valid_lft forever preferred_lft forever
```
so I am now wondering if the Virtualization solution (VMWARE ESX and VMWARE Workstation) could be impacting in the Multus-CNI.

Regards,

**Comment by Elegant996** [comment]
I also have ESXi for this setup and have had no issue. The ping likely did not work as it still probably following the default route which may not have access to your other gateway (mine does but that's a different story).

I see that the `sbr` plugin was not used. You will still have an issue with routing tables at the end of day, why avoid using it?

**Comment by helioaymoto** [comment]
Hi @Elegant996 ,
what´s the cni plugin that you are using?
I am using flannel... I don't have static and sbr plugins:
```
[tecnotree@kub-1 ~]$ ls -ltr /opt/cni/bin
total 83688
-rwxr-xr-x 1 root root  3890407 Oct 10 16:35 bridge
-rwxr-xr-x 1 root root  2775211 Oct 10 16:35 cnitool
-rwxr-xr-x 1 root root  9921982 Oct 10 16:35 dhcp
-rwxr-xr-x 1 root root  2814104 Oct 10 16:35 flannel
-rwxr-xr-x 1 root root  2991965 Oct 10 16:35 host-local
-rwxr-xr-x 1 root root  3475802 Oct 10 16:35 ipvlan
-rwxr-xr-x 1 root root  3026388 Oct 10 16:35 loopback
-rwxr-xr-x 1 root root  3520724 Oct 10 16:35 macvlan
-rwxr-xr-x 1 root root  2606733 Oct 10 16:35 noop
-rwxr-xr-x 1 root root  3470464 Oct 10 16:35 portmap
-rwxr-xr-x 1 root root  3877986 Oct 10 16:35 ptp
-rwxr-xr-x 1 root root  2808402 Oct 10 16:35 tuning
-rwxr-xr-x 1 root root  3475750 Oct 10 16:35 vlan
-rwxr-xr-x 1 root root 34359288 Oct 15 14:15 multus
```
Regards.

**Comment by Elegant996** [comment]
@helioaymoto 

I received some notifications regarding your posts, I did notice that in those yaml files you posted you kept my `"master": "net0"`. Please be sure to specify the correct interface `ens192` or `ens33` or other. Thanks!

**Comment by helioaymoto** [comment]
Hi @Elegant996 ,
yes, I've just seen this error later then I delete the post once I was going to re-run the test again.
I have compile cni pluggins so I could have static and sbr pluggins....
```
total 101216
-rwxr-xr-x 1 root root  4162470 Oct 17 18:36 bandwidth
-rwxr-xr-x 1 root root  5992855 Oct 17 18:36 firewall
-rwxr-xr-x 1 root root  4116580 Oct 17 18:36 host-device
-rwxr-xr-x 1 root root  3402249 Oct 17 18:36 sbr
-rwxr-xr-x 1 root root  2913026 Oct 17 18:36 static
-rwxr-xr-x 1 root root  3890407 Oct 17 18:40 bridge
-rwxr-xr-x 1 root root  2775211 Oct 17 18:40 cnitool
-rwxr-xr-x 1 root root  9921982 Oct 17 18:40 dhcp
-rwxr-xr-x 1 root root  2814104 Oct 17 18:40 flannel
-rwxr-xr-x 1 root root  2991965 Oct 17 18:40 host-local
-rwxr-xr-x 1 root root  3475802 Oct 17 18:40 ipvlan
-rwxr-xr-x 1 root root  3026388 Oct 17 18:40 loopback
-rwxr-xr-x 1 root root  3520724 Oct 17 18:40 macvlan
-rwxr-xr-x 1 root root  2606733 Oct 17 18:40 noop
-rwxr-xr-x 1 root root  3470464 Oct 17 18:40 portmap
-rwxr-xr-x 1 root root  3877986 Oct 17 18:40 ptp
-rwxr-xr-x 1 root root  2808402 Oct 17 18:40 tuning
-rwxr-xr-x 1 root root  3475750 Oct 17 18:40 vlan
-rwxr-xr-x 1 root root 34359288 Oct 17 18:40 multus
```
I have configure **NetworkAttachmentDefinition** as you have indicated:
```
apiVersion: "k8s.cni.cncf.io/v1"
kind: NetworkAttachmentDefinition
metadata:
  name: macvlan-conf
spec:
  config: '{
    "cniVersion": "0.3.1",
    "name": "macvlan-conf",
    "plugins": [
      {
        "type": "macvlan",
        "master": "ens192",
        "ipam": {
          "type": "static",
          "addresses": [
            {
                "address": "192.168.52.231/24",
                "gateway": "192.168.52.1"
            }
          ],
          "dns": {
            "nameservers" : ["194.42.56.196"]
          }
        }
      },
      {
        "type": "sbr"
      }
    ]
  }'
```
When running the POD with this, I don't have the router for 192.168.52.0 network... just the IP:
```
[helio@kub-1 multus-cni]$ kubectl exec -it samplepod -- bash
[root@samplepod /]# ip a
1: lo: <LOOPBACK,UP,LOWER_UP> mtu 65536 qdisc noqueue state UNKNOWN group default qlen 1000
    link/loopback 00:00:00:00:00:00 brd 00:00:00:00:00:00
    inet 127.0.0.1/8 scope host lo
       valid_lft forever preferred_lft forever
3: eth0@if12: <BROADCAST,MULTICAST,UP,LOWER_UP> mtu 1450 qdisc noqueue state UP group default
    link/ether 0a:58:0a:2a:00:13 brd ff:ff:ff:ff:ff:ff link-netnsid 0
    inet 10.42.0.19/24 scope global eth0
       valid_lft forever preferred_lft forever
4: net1@if2: <BROADCAST,MULTICAST,UP,LOWER_UP> mtu 1500 qdisc noqueue state UNKNOWN group default
    link/ether 2e:c7:00:54:98:7b brd ff:ff:ff:ff:ff:ff link-netnsid 0
    inet 192.168.52.231/24 scope global net1
       valid_lft forever preferred_lft forever
[root@samplepod /]# netstat -rn
Kernel IP routing table
Destination     Gateway         Genmask         Flags   MSS Window  irtt Iface
0.0.0.0         10.42.0.1       0.0.0.0         UG        0 0          0 eth0
10.42.0.0       0.0.0.0         255.255.255.0   U         0 0          0 eth0
10.42.0.0       10.42.0.1       255.255.0.0     UG        0 0          0 eth0
```
I can ping "192.168.52.1", but it's going via eth0 nic by default once there is no specific route via net1:
```
[root@samplepod /]# ping 192.168.52.1
PING 192.168.52.1 (192.168.52.1) 56(84) bytes of data.
64 bytes from 192.168.52.1: icmp_seq=1 ttl=63 time=0.451 ms
64 bytes from 192.168.52.1: icmp_seq=2 ttl=63 time=0.504 ms
^C
--- 192.168.52.1 ping statistics ---
2 packets transmitted, 2 received, 0% packet loss, time 1000ms
rtt min/avg/max/mdev = 0.451/0.477/0.504/0.034 ms
+-+-+-+-+-+-+-+-+-+
[root@samplepod /]# ping -I eth0 192.168.52.1
PING 192.168.52.1 (192.168.52.1) from 10.42.0.19 eth0: 56(84) bytes of data.
64 bytes from 192.168.52.1: icmp_seq=1 ttl=63 time=0.400 ms
64 bytes from 192.168.52.1: icmp_seq=2 ttl=63 time=0.438 ms
^C
--- 192.168.52.1 ping statistics ---
2 packets transmitted, 2 received, 0% packet loss, time 999ms
rtt min/avg/max/mdev = 0.400/0.419/0.438/0.019 ms
``` 
and it fails when I tried to ping forcing to use net1:
```
[root@samplepod /]# ping -I net1 192.168.52.1
PING 192.168.52.1 (192.168.52.1) from 192.168.52.231 net1: 56(84) bytes of data.

^C
--- 192.168.52.1 ping statistics ---
36 packets transmitted, 0 received, 100% packet loss, time 35000ms
```

Regards,
Helio

**Comment by Elegant996** [comment]
There is a route though, you're just looking the wrong table ;)

Try running these two commands, you should get different outputs:

`ip route show table local` -> default using `eth0`
`ip route show table 100` -> added by `sbr` using `net1`

The question is, what about do you see in `table 100`? Are you able to ping `net1` from other devices on the same subnet?

**Comment by helioaymoto** [comment]
Hi @Elegant996 ,
the "ip router" in the POD are:
```
[root@samplepod /]# ip route show table local
broadcast 10.42.0.0 dev eth0 proto kernel scope link src 10.42.0.19
local 10.42.0.19 dev eth0 proto kernel scope host src 10.42.0.19
broadcast 10.42.0.255 dev eth0 proto kernel scope link src 10.42.0.19
broadcast 127.0.0.0 dev lo proto kernel scope link src 127.0.0.1
local 127.0.0.0/8 dev lo proto kernel scope host src 127.0.0.1
local 127.0.0.1 dev lo proto kernel scope host src 127.0.0.1
broadcast 127.255.255.255 dev lo proto kernel scope link src 127.0.0.1
broadcast 192.168.52.0 dev net1 proto kernel scope link src 192.168.52.231
local 192.168.52.231 dev net1 proto kernel scope host src 192.168.52.231
broadcast 192.168.52.255 dev net1 proto kernel scope link src 192.168.52.231
[root@samplepod /]#
[root@samplepod /]# ip route show table 100
default via 192.168.52.1 dev net1
```
The "ping -I net1 192.168.52.1" works... It´s possible to see that it has selected the correct NIC and source IP:
```
[root@samplepod /]# ping -I net1 192.168.52.1
PING 192.168.52.1 (192.168.52.1) from 192.168.52.231 net1: 56(84) bytes of data.
```
Even trying "ping -I 192.168.52.231 192.168.52.1" it did not work:
```
[root@samplepod /]# ping -I 192.168.52.231 192.168.52.1
PING 192.168.52.1 (192.168.52.1) from 192.168.52.231 : 56(84) bytes of data.
From 192.168.52.231 icmp_seq=12 Destination Host Unreachable
From 192.168.52.231 icmp_seq=13 Destination Host Unreachable
From 192.168.52.231 icmp_seq=14 Destination Host Unreachable
From 192.168.52.231 icmp_seq=15 Destination Host Unreachable
^C
--- 192.168.52.1 ping statistics ---
26 packets transmitted, 0 received, +4 errors, 100% packet loss, time 25005ms
```

I cannot ping 192.168.52.231 from other server in the same subnet...
```
[root@camelgw ~]# ip a
2: ens192: <BROADCAST,MULTICAST,UP,LOWER_UP> mtu 1500 qdisc mq state UP group default qlen 1000
    link/ether 00:50:56:84:3c:6f brd ff:ff:ff:ff:ff:ff
    inet 192.168.52.151/24 brd 192.168.52.255 scope global noprefixroute ens192
       valid_lft forever preferred_lft forever
    inet6 fe80::2940:a81b:af74:2eee/64 scope link noprefixroute
       valid_lft forever preferred_lft forever

[root@camelgw ~]# ping 192.168.52.231
PING 192.168.52.231 (192.168.52.231) 56(84) bytes of data.
From 192.168.52.151 icmp_seq=1 Destination Host Unreachable
From 192.168.52.151 icmp_seq=2 Destination Host Unreachable
From 192.168.52.151 icmp_seq=3 Destination Host Unreachable
From 192.168.52.151 icmp_seq=4 Destination Host Unreachable
^C
--- 192.168.52.231 ping statistics ---
5 packets transmitted, 0 received, +4 errors, 100% packet loss, time 4000ms
```
Well... I am still looking in what the issue can be... :-)
Thanks

**Comment by helioaymoto** [comment]
Hi @Elegant996 ,

I was analyzing a little bit more today and I found that the traffic is outgoing from the POD to K8S Worker node, and going out from the worker to the network.... but the response is not coming back....
I saw this running a tcpdump for icmp traffic on the worker node and I run a ping from the POD:
```
[helio@kub-1 ~]$ kubectl exec -it samplepod -- bash
[root@samplepod /]# ip a
1: lo: <LOOPBACK,UP,LOWER_UP> mtu 65536 qdisc noqueue state UNKNOWN group default qlen 1000
    link/loopback 00:00:00:00:00:00 brd 00:00:00:00:00:00
    inet 127.0.0.1/8 scope host lo
       valid_lft forever preferred_lft forever
3: eth0@if12: <BROADCAST,MULTICAST,UP,LOWER_UP> mtu 1450 qdisc noqueue state UP group default
    link/ether 0a:58:0a:2a:00:13 brd ff:ff:ff:ff:ff:ff link-netnsid 0
    inet 10.42.0.19/24 scope global eth0
       valid_lft forever preferred_lft forever
4: net1@if2: <BROADCAST,MULTICAST,UP,LOWER_UP> mtu 1500 qdisc noqueue state UNKNOWN group default
    link/ether 2e:c7:00:54:98:7b brd ff:ff:ff:ff:ff:ff link-netnsid 0
    inet 192.168.52.231/24 scope global net1
       valid_lft forever preferred_lft forever
[root@samplepod /]# ping -I 192.168.52.231 192.168.52.1
PING 192.168.52.1 (192.168.52.1) from 192.168.52.231 : 56(84) bytes of data.
^C
--- 192.168.52.1 ping statistics ---
25 packets transmitted, 0 received, 100% packet loss, time 24000ms
```
and in the worker server, I can see the ICMP packet leaving the server:
```
[root@kub-1 ~]# tcpdump -i ens192 icmp
tcpdump: verbose output suppressed, use -v or -vv for full protocol decode
listening on ens192, link-type EN10MB (Ethernet), capture size 262144 bytes
11:41:37.060004 IP 192.168.52.231 > gateway: ICMP echo request, id 181, seq 1, length 64
11:41:38.059318 IP 192.168.52.231 > gateway: ICMP echo request, id 181, seq 2, length 64
11:41:39.059290 IP 192.168.52.231 > gateway: ICMP echo request, id 181, seq 3, length 64
11:41:40.059462 IP 192.168.52.231 > gateway: ICMP echo request, id 181, seq 4, length 64
```
so... for some reason, the 192.168.52.1 and/or the network is not able to find the route back to POD IP (192.168.52.231)....
In fact, I was searching on google and I think ESX is actually not allowing this traffic going out of the VM to the network... I mean, ESX is filtering this traffic... mainly because the MacAddress it not actually the MacAddress of the VM, but it's a different one assigned to net1 in the POD.
This is just a suspect, because of this link on vmware:
https://docs.vmware.com/en/VMware-vSphere/6.7/com.vmware.vsphere.security.doc/GUID-942BD3AA-731B-4A05-8196-66F2B4BF1ACB.html
In this link it´s commenting that there is a security policy in the ESXi vswitch to affect the incoming traffic to a VM when a mac address change....
I am going to talk the IT Support guys to see if they can change this option in the ESXi vswitch configuration.
Regards,

**Comment by currycan** [comment]
> Hi @Elegant996 ,
> 
> I was analyzing a little bit more today and I found that the traffic is outgoing from the POD to K8S Worker node, and going out from the worker to the network.... but the response is not coming back....
> I saw this running a tcpdump for icmp traffic on the worker node and I run a ping from the POD:
> 
> 
> ```
> [helio@kub-1 ~]$ kubectl exec -it samplepod -- bash
> [root@samplepod /]# ip a
> 1: lo: <LOOPBACK,UP,LOWER_UP> mtu 65536 qdisc noqueue state UNKNOWN group default qlen 1000
>     link/loopback 00:00:00:00:00:00 brd 00:00:00:00:00:00
>     inet 127.0.0.1/8 scope host lo
>        valid_lft forever preferred_lft forever
> 3: eth0@if12: <BROADCAST,MULTICAST,UP,LOWER_UP> mtu 1450 qdisc noqueue state UP group default
>     link/ether 0a:58:0a:2a:00:13 brd ff:ff:ff:ff:ff:ff link-netnsid 0
>     inet 10.42.0.19/24 scope global eth0
>        valid_lft forever preferred_lft forever
> 4: net1@if2: <BROADCAST,MULTICAST,UP,LOWER_UP> mtu 1500 qdisc noqueue state UNKNOWN group default
>     link/ether 2e:c7:00:54:98:7b brd ff:ff:ff:ff:ff:ff link-netnsid 0
>     inet 192.168.52.231/24 scope global net1
>        valid_lft forever preferred_lft forever
> [root@samplepod /]# ping -I 192.168.52.231 192.168.52.1
> PING 192.168.52.1 (192.168.52.1) from 192.168.52.231 : 56(84) bytes of data.
> ^C
> --- 192.168.52.1 ping statistics ---
> 25 packets transmitted, 0 received, 100% packet loss, time 24000ms
> ```
> 
> and in the worker server, I can see the ICMP packet leaving the server:
> 
> 
> ```
> [root@kub-1 ~]# tcpdump -i ens192 icmp
> tcpdump: verbose output suppressed, use -v or -vv for full protocol decode
> listening on ens192, link-type EN10MB (Ethernet), capture size 262144 bytes
> 11:41:37.060004 IP 192.168.52.231 > gateway: ICMP echo request, id 181, seq 1, length 64
> 11:41:38.059318 IP 192.168.52.231 > gateway: ICMP echo request, id 181, seq 2, length 64
> 11:41:39.059290 IP 192.168.52.231 > gateway: ICMP echo request, id 181, seq 3, length 64
> 11:41:40.059462 IP 192.168.52.231 > gateway: ICMP echo request, id 181, seq 4, length 64
> ```
> 
> so I can see the outgoing traffic, but for some reason, the 192.168.52.1 and/or the network is not able to find the route back to POD IP (192.168.52.231)....
> In fact, I was searching on google and I think ESX is actually not allowing ICMP response traffic coming back to the VM... I mean, ESX is filtering this traffic (icmp response)... mainly because the MacAddress it not actually the MacAddress of the VM, but it's a different one assigned to net1 in the POD.
> This is just a suspect, because of this link on vmware:
> https://docs.vmware.com/en/VMware-vSphere/6.7/com.vmware.vsphere.security.doc/GUID-942BD3AA-731B-4A05-8196-66F2B4BF1ACB.html
> In this link it´s commenting that there is a security policy in the ESXi vswitch to affect the incoming traffic to a VM when a mac address change....
> I am going to talk the IT Support guys to see if they can change this option in the ESXi vswitch configuration.
> Regards,

Hi, 
  Do you resolve thispromblem? I met the same trouble

**Comment by helioaymoto** [comment]
Hi @currycan ,
I haven't found the problem yet.
I have tried to change the ESX vswitch configuration as I commented before, but it´s not working.
For some reason vswitch is filtering the traffic from/to the POD, most probability because it´s not aware of the mac address of the POD.
Regards,
Helio

**Comment by elgamal2020** [comment]
Hello , I have the same issue over openstack enviroment , I have disabled antispoofing but still it is not working

**Comment by helioaymoto** [comment]
Hi @elgamal2020,
sorry, but I do not know too much about openstack.... in my case, the issue is really on the vmWare vSphere vswitch... it´s mainly not allowing traffic from/to an unknown MAC because it´s not aware of it.... I tried some configuration at vswitch level, but none of them works.
I got this working in vmWare workstation virtual machine,  but the workstation architecture is simpler than vSphere, so it has less secure issue to cause this type of problem.
Recently I got similar issue when i was playing with LXD/LXC containers....  and I could get a public IP in new NIC card (via macvlan), but no traffic in vSphere virtual machines and works using virtual box.....
Regards,

**Comment by emailtovinod** [comment]
@helioaymoto 

I just configured Multus - type:macvlan - on my VSPhere environment. To reach the POD interface from outside the VM, you need to configure the following settings on the `VM Network ` of the `Virtual Switch`. You can find these settings in the path  - Virtual Switches -> VMm Network -> Edit Settings -> Security.
------------------------------
Promiscuous mode  - Override

MAC address changes - Override

Forged transmits -  Override 
--------------------------------

**Comment by szgRunner** [comment]
> @helioaymoto
> 
> ## I just configured Multus - type:macvlan - on my VSPhere environment. To reach the POD interface from outside the VM, you need to configure the following settings on the `VM Network ` of the `Virtual Switch`. You can find these settings in the path - Virtual Switches -> VMm Network -> Edit Settings -> Security.
> Promiscuous mode - Override
> 
> MAC address changes - Override
> 
> Forged transmits - Override

I have changed my exsi vm by you said ,it works. thank you!

**Comment by boeboe** [comment]
I am having exactly the same problem on AWS. ICMP traffic is exiting the correct node interface on the correct secondary subnet, but it never arrives at the remote host, and hence also not on the remote pod.

**Comment by boeboe** [comment]
**Update**
I found the answer I was looking for at https://github.com/aws-samples/eks-automated-ipmgmt-multus-pods

Note that there was one more thing that I was doing wrong before everything worked. Since I am using self hosted ubuntu machines with self managed `kubeadm` to bootstrap my whole `multus` cluster on AWS, I had to manually enable IP FWing, which was one of the reasons traffic was not getting across.

    # Allow IP Forwarding
    echo "[Terraform Cloud Init] Allow IP Forwarding"
    sed -i 's/#net.ipv4.ip_forward=1/net.ipv4.ip_forward=1/g' /etc/sysctl.conf
    sed -i 's/#net.ipv4.conf.all.rp_filter=1/net.ipv4.conf.all.rp_filter=2/g' /etc/sysctl.conf
    
    
The output of this `multus` experiment with `aws-cni` is summarized on the following Terraform module I am working on currently (WIP): https://github.com/boeboe/terraform-aws-k8s-multus-gtp5g

For some reason, this was not necessary with `calico-cni` (without `aws-cni`) so I am assuming `calico-cni` does this out of the box for you.

**Comment by brunodzogovic** [comment]
I think I know what the problem here is. Presumably, you're routed in NAT and your gateway keeps ARP table of your physical hosts (in this case your hypervisor, the VMs). To be able to recognize the pod and container running an interface with a same IP in the subnet, your interface needs a MAC address. Multus can't specify MAC automatically  for the pod and therein you need to do it manually, or as follows (an example of a 192.168.10.0/24 network) where you need to add a line `"capabilities": { "macs": true }`: 
```
spec:                                      
  config: '{                               
    "cniVersion": "0.3.1",                 
    "plugins": [                           
      {                                    
        "type": "macvlan",                 
        "master": "eno1",                  
        "mode": "bridge",                  
        "ipam": {                          
          "type": "static",                
          "routes": [                      
            {                              
              "dst": "192.168.10.0/24",    
              "gateway": "192.168.10.1"    
            }                              
          ],                               
          "gateway": "192.168.10.1", # this you don't need if you specify the gateway in your pod manifest      
          "capabilities": { "macs": true }
        }                                  
      }                                    
    ]                                      
  }'                                       
```              
The execution of the pod will assign it a random MAC address. Note that you will need to use switch that supports promiscuous mode and trunking in order to use MACVLAN on a physical subnet.
